,title
0,TOP AI MEME COIN FOR 2025
1,What Happens After The Crypto Top Will SHOCK You!
2,Crypto's MOST Exciting Narrative EVER! [NOT AI + VERY Early]
3,Final Phase Of Crypto Pullback Incoming! (ALTCOIN BUY ZONES!)
4,Altseason Hinges On Bitcoin’s Next CRITICAL Move!
5,CAUTION ⚠️ Pullback Still In Play!! [ALTCOIN BUY ZONES INCOMING]
6,BREAKING NEWS: This Changes EVERYTHING For CRYPTO!!!
7,The LAST Crypto Portfolio I’ll Ever Buy! (Urgent Update)
8,Pullback Not Over!! Incredible Altcoin Buy Zones Incoming [MY NEXT TRADES]
9,This SIMPLE Day Trading Strategy Makes Me $30k/Month (How To Copy It)
10,The MOST Profitable Time In  Crypto Is Coming... [TOP PICKS]
11,WARNING! This Signal Says Crypto Is About To Get Violent!
12,WARNING! Most Will Fall for This Bitcoin Trap!
13,LBank Leverage Tutorial For Beginner Cryto Traders [2025]
14,Missed the Virtuals Boom? This One’s Flying Under the Radar!
15,The Long Awaited Altcoin Buy-Zones Have Hit! (TIME TO BUY)
16,"We’re going MUCH higher from here."" - Arthur Hayes"
17,COINBASE HACKED! Will Bitcoin CRASH On This News?
18,"MASSIVE BITCOIN BREAKOUT PATTERN FORMING! Is Bitcoin About To TELEPORT To $120,000?"
19,💰Top 5 Crypto For High Returns🔥#crypto #cryptocurrency #trading
20,How to Turn ₹1 Lakh into ₹1 Crore in 2025 | Winning Stock Strategy | Deepak Wadhwa | #trading #money
21,Don't Miss These 3 Investment Ideas💰
22,"Stop Overthinking, Just Focus on These Simple Stock Strategies! 📊💡| Deepak Wadhwa @stockswithrochit"
23,How to Turn ₹500 Into ₹1.5 Crore | Power of Compounding Explained! | Deepak Wadhwa | #trading #money
24,I launch my trading course! #stockmarket #tradingcommunity
25,Sectors to invest in India #sector #stockmarket
26,Bank Nifty Trading Strategy | First 30-Min Candle Setup | Deepak Wadhwa | #stocks #money #nifty
27,You will loose your all money if you're trading like this!😫😨 #stockmarket #trading #sorts
28,How to protect your crypto?🤔#crypto #cryptocurrency #bitcoin
29,Truth About Pump & Dump Crypto Schemes with @stockswithrochit  | Deepak Wadhwa | #pump #dump #money
30,Why I'm NOT Buying Crypto in 2025 | Wait for THIS Signal! | Deepak Wadhwa & @accurate_arun  #crypto
31,Don't miss these meme coins for high returns💰#crypto #cryptocurrency #memecoin
32,💡 Why You MUST Activate the MWP Clause on Your Life Insurance! 🔥💰| Deepak Wadhwa | #insurance
33,Build Crores With Just 20K SIP💰🔥#sip #returns
34,How to Turn ₹5000 into Crores: Best Coins to Invest in 2025! 🚀💰| Deepak Wadhwa | #trading #crypto
35,Crypto Trading Made Easy for Future Financial Growth || @iamyashgupta #podcast #bitcoin #deeptalks
36,I did this mistake & lost my all money! 😨😫#stockmarket #trading #mistakes
37,How he earned 10 crores at the age of 40? Podcast with @Sanjay_Kathuria | #deeptalks #podcast #sip
38,What changes can we expect after Elections? 🗳
39,Don't miss huge profits of crypto🔥#crypto #cryptocurrency
40,Aniruddhacharya Ji: Viral बाबा ka Stock Market Connection @Aniruddhacharyaji #podcast
41,@AbhishekKar  Exposed | Secrets of Wealth & The Illuminati Unveiled! | #deeptalks #podcast #srk
42,Complete Cryptocurrency Research Guide for Beginners | Deepak Wadhwa | #crypto #stocks #deepakwadhwa
43,Which ETF Will Give the Best Returns? #deeptalks #stockmarket
44,The Journey from Job to a Professional Trader ft. Arjun Tandon | The Deep Talks - Ep. 2
45,Don't Miss These 4 Monopoly Stocks💰#stockmarket #stocks
46,Top 3 Multibagger Stocks | Chart Formation | Huge Profits in Stocks | Deepak Wadhwa | #trading
47,Do you invest in penny stocks? #stockmarket #trading
48,Crypto vs Stocks: 494M% Returns in Days! 🚀 | Top Crypto Coins for 2025 | Deepak Wadhwa | #stocks
49,Market Master: Non-Lagging Indicator Insights || @ghosttradeindia
50,Pankaj Bhardwaj Reveals Secret Trading Strategies | Podcast 2.0 #stockmarket #stockmarketstrategies
51,Market Behaviour vs Knowledge: Sahil Rohmehtra's Trading Insights | The Deep Talks #traderpodcast
52,Top 4 Cryptos You Can’t Ignore in 2025!🚀#cryptocurrency #crypto
53,Most Important Lessons for Successful Trading #stockmarket #trading
54,Water Stocks: Next Big Thing! 💧🚀#waterinfrastructure #stockmarket
55,"10,000 to lakhs option buying road map from expert | ft. Roshan | #deeptalks #stockmarket"
56,Easiest Way to Find Multibagger Stocks with @stockswithrochit || #deeptalks #podcast
57,Crypto Reality Check | Can Penny Cryptos Ever Hit $1? | Deepak Wadhwa | #trading #crypto #money
58,Easiest Way to Read Stock Charts in 5 Minutes! 📊🔥| Deepak Wadhwa | #trading #stockmarket #charts
59,"How to use astrology in stock market, What is laal kitab ? Ft. Dr Yogesh Sharma @HappyLifeAstro"
60,Discover the Best Websites to Find Multibagger Stocks 📈💰#multibaggerstocks  @stockswithrochit
61,Where Will Bitcoin in 4 Years? #bitcoin #cryptocurrency
62,💰5 Companies With Order Book Bigger Than Market Cap🔥#orderbook #marketcap #stockmarket
63,Swing Trading Strategy || Deepak Wadhwa Podcast
64,Master the power of option buying for huge profits || @NitinMurarkaNifty
65,🚨 People are losing money in Bank Nifty. Here's how to avoid those losses and make profits! #shorts
66,Top Futuristic Sector for High Returns💰#stockmarket #stocks
67,Crypto Market: Will the Bull Run Last? | Predictions & Risks Explained | Deepak Wadhwa | #crypto
68,🚀 Meme Coins vs. Top 10 Crypto – Where Should You Invest? 💰📉 | Deepak Wadhwa | #cryptotips #meme
69,30% tax on FnO trading profits? 🚨🤔
70,Best time to trade! #stocks #trading
71,Trump’s Tariff Move Explained 🇺🇸📈 | Why US Prices May Rise! | Deepak Wadhwa | #money #trump #tariffs
72,Options Trading Demystified in 60 Seconds || @SuperTraderLakshya
73,"Abhishek Kar reveals stock tips, billionaire strategies and secret to luxury life | #deeptalks"
74,Nifty to Hit All-Time High Before August! 🚀 | Deepak Wadhwa with Rochit Singh | #stocks #nifty
75,How To Earn 1 Crore With Just ₹10000 Per Month?💰#mutualfunds  #money
76,Right time to exit from trading #stockmarket #trading
77,Best Free Websites for Traders | Free Trading Tools for Beginners 💰📊 | DeepakWadhwa | #trading
78,Key to regular income from stock market | #deeptalks #stockmarket
79,StopLoss or Stop Your Loss - Smart Stoploss By Deepak Wadhwa
80,Make money with option seller #optiontrading
81,How To Make Big And Easy Money in Stock Market by Investing & Trading | @Mrinmoyaieducator
82,Which Option Call Does Roshan Buy? #deeptalks #stockmarket
83,Share Market में सिर्फ़ Profit होगा || Ft. Jasneet Singh #trading #podcast
84,Don't Get Involved In These Ponzi Scheme🔥#money #scheme
85,🍽️ My Favorite Food Spots! Best Street & Restaurant Food Guide 🤤| Deepak Wadhwa | #food #foody
86,Delta Exchange is for  traders or for investors and its regulations🤔.@deltaexchange #crypto
87,🤔How to find multibagger stocks?🤯#stockmarket #multibaggerstocks
88,Sectors to benefit from Modi Govt!! 📈💯
89,Top option strategies – Maximize Profits & Minimize Risks! | Deepak Wadhwa |
90,CRYPTO TRADING COURSE for FREE Learn Crypto like a PRO by Deepak Wadhwa | #trading #crypto #bitcoin
91,Game Changing Indicators for Option Traders || PROFIT making strategy with PUNCH by Deepak Wadhwa
92,Where to invest in India ? #stockmarket #trading
93,Perfect option strategies roadmap by pro trader Reyansh #deeptalks #stockmarket
94,What’s your Doge coin prediction?👇#dogecoin #cryptocrypto
95,**Money Making Remedy** @AstroWala
96,Mistakes every trader do! #stockmarket #trading #investing
97,Nifty & Bank Nifty Options Trading: PCR Strategy & Live Market Analysis with Nitin Murarka
98,Passive income from Crypto trading for beginners | Ft. Pankaj Balani from Delta Exchange #crypto
99,Option Selling Secrets: How to Win Consistently!
100,Don't Miss The Opportunity Of Stock Market🔥#stockmarket #trading
101,Option Trading: Tips from Super Trader Lakshya || @SuperTraderLakshya
102,Nifty EV and New Age Automotive Index! 🚗🔥 #nse #nifty
103,Bank Nifty Downfall: @Malkansview1 #shorts
104,OSHO's Life | His complete journey by Anand Arun | osho hindi speech | osho biography in hindi
105,Crypto Investment Truth: What They Won't Tell You About Bitcoin & Solana | Deepak Wadhwa | #shorts
106,Best Intraday Indicator for Bank NIFTY 🔥 | 5-Min Chart + 21 EMA Strategy Explained! | Deepak Wadhwa
107,Beware of this trading scam! 📈🎯#stockmarket #trading #stocks
108,Relation Between Your Good Gut Health And Big Money Making || @ramvermanlp #podcast #deeptalks #nlp
109,Decide market future with this method! #stockmarket #trading
110,My Trading Secret! | Apps that I use for Trading!
111,What is bhav copy? #trading #stockmarket
112,How he became a profitable options trader! #deeptalks #stockmarket
113,CRYPTOS MADE EASY WITH DEEPAK WADHWA | 19th  January 2025 (NEW REFERAL LINK)
114,Shikha Pruthi’s Inspirational Trading Journey & Secret Strategies! #deeptalks #stockmarket
115,Market Crashes Are Actually GOOD for Your SIP! | Investor's Secret Weapon | Deepak Wadhwa | #stocks
116,How to invest in shares at Pre IPO stage
117,How Much Term Insurance Should You Take? | Best Advice for Indians | Deepak Wadhwa | #insurance
118,Invest in Top Stocks with Just ₹200! 🚀💰| Deepak Wadhwa | #stockmarket #investing #money #stocks
119,CRYPTOS MADE EASY WITH DEEPAK WADHWA | 26th January 2025 (NEW REFERAL LINK)
120,Aakhir ye Operator hai kon? 🧐
121,Reasons for Divorce in Wealthy Families | @AbhishekKar
122,100 crore ki journey आसान शब्दों में || Ft. Akhil Gupta
123,"Dark Reality Of Trading Tips Or Experts, That You Should Know | #joshtalks #tradingexperts #stocks"
124,Remarkable Growth of a Boy From Small Town to Big Luxury Cars at age of 22 || @shashwatamrev
125,Trading सीखो और कमाओ! Trading start कर रहे हो तो yeh एक pro tip सुन लो | #trading #tradingcharts
126,One Strategy can change your entire trading game! #stockmarket #stockmarketstrategies
127,He Turned Losses Into Profits – Roshan’s Option Trading Secrets! #deeptalks #optionstrading
128,💰Earn Money With Sector Rotation🔥#stockmarket #profit
129,🚀 Crypto Bull Run? How Long Will It Last? | Future of Crypto in 2024! 🔥| Deepak Wadhwa | #crypto
130,Bitcoin & Cryptocurrencies: Clear all your doubts Now | Ft Jeet Shah | #deeptalks #crypto
131,💰Learning Is Better Than Loss🔥#stockmarket #loss #learning
132,300K followers announcement!! 💯🔥
133,Trader ko loss se kya seekhna chahiye? 🤔
134,CRYPTOS MADE EASY WITH DEEPAK WADHWA | 2nd February 2025 (NEW REFERAL LINK)
135,🤫 Stocks mein paise banane ka secret jano expert se!
136,Don't Get Fooled By Others🤯#telegram #scammer
137,AI-Game changer in stocks and education | Ft. Santosh Kushwaha #Volkai
138,CRYPTOS MADE EASY WITH DEEPAK WADHWA | 28th January 2025 (NEW REFERAL LINK)
139,Reality of mutual fund #mutualfunds #investment
140,Don't Miss Crypto Biggest Bull Run 2025 || Ft. Yash Gupta
141,"Nifty & Bank Nifty Fall, But These 3 Stocks Are Rising! | Deepak Wadhwa | #trading #money #stocks"
142,Want to learn Crypto Trading? | Deepak Wadhwa | #stockmarket #crypto #trading #money #cryptotrading
143,"Sanjay Kathuria: Stock Market, Mutual Funds & Wealth Growth Explained | Podcast 2.0 | #stockmarket"
144,Master Futures Trading: Watch Live $1600 in Under 1 Hour! || ‪@SniperAutoTraders
145,Stop Overthinking Before It Hurts You || @ANURAGRISHI
146,Kya sach me market crash ho gaya? 😲 #stockmarket #trading
147,Budget 2025: No Tax Up to ₹12 Lakh! | Huge Opportunity for Investors 🚀 | Deepak Wadhwa | #budget
148,"Comment ""Link"" for more details🔥#stockmarket #trading"
149,"Crypto trade with zero commission brokerage || Live crypto market analysis || 20th Nov, 2024"
150,CRYPTOS MADE EASY WITH DEEPAK WADHWA | 25th January 2025 (NEW REFERAL LINK)
151,Who is a Successful Trader?🤔#trader #stockmarket
152,Market Expert से सीखे Crore का Business बनाना || Ft. Basesh Gala
153,Manifest anything : attract money in your life || Deepak Wadhwa Podcast
154,CRYPTOS MADE EASY WITH DEEPAK WADHWA | 21st January 2025 (NEW REFERAL LINK)
155,Trade With World's best Non-lagging indicator || @ghosttradeindia || Part 2
156,Sujal’s Secret Strategy for Consistent Profits! #deeptalks
157,93% Traders Are Losing Money! Here’s Why & How to Fix It! 💰🚨
158,Discussion with CNBC Managing Editor #cnbc #anujsinghal
159,Live crypto market analysis | 06th January 2025
160,CRYPTOS MADE EASY WITH DEEPAK WADHWA | 18th  January 2025 (NEW REFERAL LINK)
161,5 Minutes a Day to BOOST Your Confidence and Stay FOCUSED || @UjjwalPatni || Deepak Wadhwa
162,Live crypto market analysis | 21st December 2024
163,Super Exciting Podcast Alert! ft. Aditya panchwaria
164,CRYPTOS MADE EASY WITH DEEPAK WADHWA | 27th January 2025 (NEW REFERAL LINK)
165,Dr. Aniruddhacharya Ji on Deeptalks – A Sneak Peek into Spirituality!
166,💰Watch This Before Investing In Mutual Funds🔥#stockmarket #mutualfunds
167,How To Save Capital In Trading ? #stockmarket #shorts
168,CRYPTOS MADE EASY WITH DEEPAK WADHWA | 16th  January 2025 (NEW REFERAL LINK)
169,"How to Build ₹100 Crore Wealth with SIP | Start Early, Retire Rich"
170,"Crypto trade with zero commission brokerage || Live crypto market analysis || 16th Nov, 2024"
171,CRYPTOS MADE EASY WITH DEEPAK WADHWA | 22nd January 2025 (NEW REFERAL LINK)
172,India's got latent controversy | Ranveer Allahbadia | Samay raina fulll video @SamayRainaOfficial
173,Live crypto market analysis | 13th  January 2025 (HAPPY LOHRI)
174,CRYPTO TRADING WITH  Deepak Wadhwa | 9th March 2025 (NEW REFERAL LINK)
175,SIP vs Stock Market | Deepak Wadhwa | #sip #stockmarket #stocks #money #deepakwadhwa #trading #vs
176,Algo Trading Secrets & Insights Unveiled – Teaser Out Now #trading #newpodcast
177,"Smarter Trading, Faster Execution! 🚀📈 | Deepak Wadhwa |"
178,Market Myths Exposed: RSI 80+ Strategy for Real Profit! 📈| Deepak Wadhwa | #market #trading #money
179,Adani's Mission to Transform India's Youth | Deepak Wadhwa | #gautamadani #youth #sevaoverself
180,CRYPTOS MADE EASY WITH DEEPAK WADHWA | 23rd January 2025 (NEW REFERAL LINK)
181,Live crypto market analysis | 08th January 2025
182,CRYPTOS MADE EASY WITH DEEPAK WADHWA | 30th January 2025 (NEW REFERAL LINK)
183,How to Inves as a Beginner in 2025! #deeptalks #stockmarket
184,CRYPTO TRADING WITH  Deepak Wadhwa | 27th  February 2025 (NEW REFERAL LINK)
185,How to make money in stock market | #deeptalks #abhishekkar
186,Manifesting Stock Market Success with Gratitude || @ReadersBooksClub || Deepak wadhwa Podcast
187,🤯Don't Invest in Mutual Fund Blindly🔥#mutualfunds #sip
188,"Crypto trade with zero commission brokerage || Live crypto market analysis || 2nd Jan, 2025"
189,Crypto & Stock Market Secrets | Deepak Wadhwa with @financewitharun2236 | #trading #crypto #charts
190,CRYPTO TRADING WITH  Deepak Wadhwa | 10th March 2025 (NEW REFERAL LINK)
191,"Crypto trade with zero commission brokerage || Live crypto market analysis || 18th Nov, 2024"
192,CRYPTOS Lets make it big with Deepak Wadhwa | 7th  February 2025 (NEW REFERAL LINK)
193,What’s the secret behind this effective nifty price action method? #stockmarket #nifty
194,Is Ather a Good Option?
195,Live crypto market analysis | 09th January 2025
196,Algo Trading Secrets Revealed : with Dharmik Thakker || Deepak Wadhwa Podcast
197,CRYPTOS Lets make it big with Deepak Wadhwa | 9th  February 2025 (NEW REFERAL LINK)
198,क्यों नहीं करनी चाहिए लक्ष्मी जी की आरती? @AstroWala
199,From Beginner to Pro | Options Trading Strategies | Ft Reyansh #optionstrading #stockmarket
200,1 Million Follower || @stockswithrochit #followersinstagram #deeptalks #podcast #stockmarket
201,Coming Soon: Abhishek Kar's Exposed Podcast – Secrets of Wealth & The Illuminati Unveiled!
202,Some tips you must know as a investor!💡#stockmarket #trading #stockinvesting
203,Check the Order Book Before Investing | Fundamental Analysis Tips | Deepak Wadhwa | #trading #money
204,Intraday Equity | TheDeepTalks | @RuchirGupta1
205,Beware of Fake Accounts!! ⚠️🚨
206,"Live crypto market analysis |  14th Nov, 2024"
207,How Sebi Regulates Algo?🤔#marketstability  #tradingrules
208,पैसे की आवक with @AstroWala
209,Is Trading a Career for You? | Career Advice | Deepak Wadhwa | #trading #career #investing #money
210,📕💯 What are Highlights of Budget 2024-25?🔥#budget #trading
211,CRYPTOS MADE EASY WITH DEEPAK WADHWA | 24th January 2025 (NEW REFERAL LINK)
212,💰Don't miss these stocks for high returns🔥#stockmarket #stocks
213,What Billionaires Know That You Don’t | @AbhishekKar #deeptalks
214,Sectors to Watch which can give High Returns🔥#stockmarket #trading
215,CRYPTOS Lets make it big with Deepak Wadhwa | 15th  February 2025 (NEW REFERAL LINK)
216,CRYPTOS Lets make it big with Deepak Wadhwa | 8th  February 2025 (NEW REFERAL LINK)
217,Where Should You Invest Now | #deeptalks #sip
218,"The harsh truth? In this world, respect has a price tag! #deeptalks #harshreality"
219,WARNING TO COINBASE USERS - $400 MILLION STOLEN?! ARE YOU AT RISK?
220,Best Crypto Tracking App Ever Merlin
221,WOW COINBASE JUST CHANGED EVERYTHING FOR CRYPTO
222,XRP and HBAR massive PARTNERSHIP
223,COINBASE HACKER DRAMA JUST GOT WORSE! THEY LIED!
224,🚨PREPARE $25 TRILLION To Enter Crypto Market SOON (CRAZY XRP RIPPLE RUMOR)
225,XRP Ripple Case FAR from Over!? Time to Buy?
226,Could this be the end of crypto in America?
227,INSANE! LINK AND ONDO HOLDERS MUST WATCH (JPMorgan did this)
228,It's Time for Crypto and Bitcoin to EXPLODE!
229,XRP AND CIRCLE ACQUISITION #xrp #cryptocurrency #cryptocurrency
230,🚨SHOCKING FTX SBF TRIES TO ESCAPE JAIL
231,Bitcoin Breakout on Valentine's Day? (Altcoin gains contingent)
232,JP Morgan Chase just said BITCOIN will BEAT GOLD
233,MEMECOINS STABLECOINS AND INSIDER TRADING #crypto #memecoin #cryptonews
234,HIGHEST BITCOIN WEEKLY CLOSE EVER #crypto #bitcoin #btc
235,How To Invest In Crypto Full Beginners Guide
236,How To Make Money Using Coinbase (Beginners Guide)
237,How To Invest In Crypto Complete Beginner's Guide
238,Ultimate Beginner's Guide to Investing in Stocks
239,7 Crypto Altcoins I'm Investing In
240,How To Invest in Crypto Complete Ultimate Guide
241,my plan to make millions in the crypto bull run in 2025 | 20x altcoin strategy for beginners
242,My Top 10 Crypto Altcoins to 10x This Bull Run
243,Top 10 Cryptocurrency To Invest In For 2023
244,Crypto.com Review (2023): Full Beginners Guide & Everything You Need To Know
245,Start Dropshipping with $0 in 2024 (Complete Beginner's Guide)
246,REAL Experience Trying Out Amex Concierge Service
247,7 Best Untapped AI Businesses To Start Right Now
248,Ultimate Beginner's Guide to Credit Card Points in 2025 [Updated]
249,The Powerball is a Waste of Money
250,Top 5 Crypto Narratives To Invest in 2024
251,my top 10 cryptos im buying before 2025 begins | don't miss these 50x altcoins
252,5 Crypto Altcoins I'm Investing In 2024
253,How to Make Millions This Crypto Bull Run | My Gameplan & Strategies Explained 2025
254,Top 5 Cryptocurrency To Invest In For 2021| MASSIVE POTENTIAL
255,My Top 10 Cryptos That I'm Going All In On.
256,How to Climb the Credit Card Tiers in 2025 (Beginner's Guide)
257,How to Invest in Stocks for Beginners [Free Education Course]
258,BEST FREE CRYPTO APPS TO INVEST WITH
259,How To Become RICH in The 2023 Recession (LIFT METHOD)
260,How To Hyper Increase Your Credit Score in 2023 (800+ Credit Score)
261,my high conviction altcoins for 2025
262,TOP 3 Crypto To Invest In 2021 / HUGE POTENTIAL
263,My Plan To Make Millions In Crypto in 2024 | 100X Altcoin Strategy For Beginners
264,The Most Epic Short Squeeze In History FINANCE YT MEGA LIVE 🚀💎
265,How To Get the Amex Centurion Card (Black Card) [2023]
266,Top 5 God Tier Metaverse Coins To Invest In NOW
267,How To Earn Passive Income With Cryptocurrency
268,5 Altcoins I'm Buying During The Market Crash
269,TOP 5 CRYPTO TO INVEST IN NOW
270,Top 5 Cryptos To Invest & HOLD in 2023
271,DogeCoin SNL Livestream REACTION
272,How To Invest Your First $100 Into Crypto
273,Pionex Crypto Trading Bot | My Results & Step By Step Tutorial 2023💰
274,How To Make $100 Per Day Trading Crypto 2023
275,"Cryptocurrency, Explained"
276,My Top 5 Altcoins to Watch in 2025 – How I’m Preparing for the Next Bull Run
277,How to Start Dropshipping 2023 (Ultimate Beginners Guide)
278,Affiliate Marketing - How I Made $6900 per day (Step by Step Guide)
279,Second Stimulus Check Update | My Predictions When Is It Coming?
280,How to Invest in Crypto in 2023 - Full Beginner’s Guide
281,Amex Platinum Card - 17 Things You MUST Do Now
282,How To Start Affiliate Marketing For Beginners | $5215 per Day 2023
283,Tesla Bitcoin CRASH is AMAZING News | HERE’S WHY
284,Top 3 Crypto To Invest In 2021 (DON'T MISS OUT!)
285,Best Investing App For Beginners 2021
286,the last few days before market goes bullish again
287,AMC War Room Talk Live on Youtube
288,DogeCoin HUGE Trap?! (WATCH NOW) + SUPER ALTCOINS RISING
289,The Crypto Market CRASH | EVERYTHING YOU NEED TO KNOW
290,10 Habits To Become a Millionaire
291,4 MILLION Stimulus Debit Cards Coming This Week 😱
292,The REAL Reason Everyone's Getting Their $1200 STIMULUS CHECK But YOU 😡
293,What Income SHOULD You Put On A Credit Card Application?
294,2021 CRYPTO EXIT STRATEGY REVEALED🔥😳
295,Wednesday Morning AMC / GME Short Squeeze Live
296,4 Best Beginner Investing Apps for 2025
297,"Watch This Before Applying For American Express | (Major Updates, Rules & Guide)"
298,BRUTAL TRUTH OF SHIBA INU
299,12 Cryptos That I'm Buying This Year
300,"10 Passive Income Ideas - How I Make $89,650 per Month"
301,Top 4 MOST Underrated Crypto To Invest In 2021
302,SHIBA INU EXPOSED
303,STIMULUS CHECK UPDATE | DIRECT DEPOSIT WAVE 2 INCOMING!!
304,"HUGE Altcoin Season | Ethereum NEW $10,000 Price Target | DogeCoin Prediction"
305,American Express Platinum Card 2023 Review | 10 Secret Benefits & Tips
306,"MY NEXT +80,000% ALTCOIN BET (IMPORTANT)"
307,Why Crypto Crashed & How To Profit Right NOW
308,The Solana & Cardano KILLER 😮
309,$AMC $NKD $GME 🚀ROBINHOOD CLASS WARFARE
310,6 Profitable AI Businesses to Start Today (Recession-Proof)
311,You Only Need These 5 Credit Cards in Your Wallet ⌛
312,HOW TO INCREASE YOUR CREDIT SCORE FAST IN 2024
313,THE CRYPTO CRASH | WATCH NOW
314,"CRYPTO NEWS | Crypto Watchlist, End of Meme coins?! & MORE"
315,How to Get the Amex Centurion Card (Black Card)
316,Credit Card Tier List: Ranking BEST to WORST (2025)
317,CRYPTO RECOVERY NEWS. THE TRUTH
318,Self-Development Is Ruining Your Life
319,WARNING CRYPTO MARKET CRASH OR HUGE START TO SUPERCYCLE?!
320,WHY THE CRYPTO BULL MARKET IS NOT OVER | HUGE GOOD NEWS!
321,Top 5 Cryptos to Invest In (GET IN EARLY)
322,Crypto Market Recovery!? HUGE NEWS & WHALES MOVES
323,Second Stimulus Check Officially Confirmed In The HEALS New Act
324,The Absolute Power Of The American Express Trifecta
325,How The Crypto Bull Run Will Start in 2024. Get Ready TODAY.
326,Stories of An AMEX Black Card Concierge | My Reaction
327,Amex Gold Card - 9 Secret Benefits & Tips (Full Guide)
328,New ($2000) + $1000 Per Month Stimulus Debit Card Act
329,How To Find The NEXT Shiba Inu
330,American Express Gold Card 2023 Review | 5 Secret Benefits & Perks
331,The Coming Cardano Boom.
332,2 UNDERRATED CRYPTOS TO BUY NOW (800% Return)
333,CRYPTO GAMING METAVERSE TOO LATE OR INVEST NOW?!
334,My Next +900% Altcoin Bet
335,2 UNDERRATED CRYPTOS TO BUY NOW (800% Return)
336,CRYPTO GAMING METAVERSE TOO LATE OR INVEST NOW?!
337,My Next +900% Altcoin Bet
338,TOP 3 CRYPTO PASSIVE INCOME STRATEGIES | FULL GUIDE 2023
339,How I Made My First $100k at 20 Years Old
340,We need to talk… (Crypto Truth)
341,How I Became A Millionaire AND YOU CAN TOO.
342,Phase 4 Stimulus Package Update | My Predictions
343,3 Passive Income Strategies With Crypto You NEED NOW
344,When Is The Second Stimulus Check Coming Out?
345,The Next 100x Cardano Altcoin
346,The Next Cardano Explosion
347,How to Get Massive Credit Limit Increases
348,Paying Off My Mom's Credit Card Debt She Carried For Over 10 Years
349,"MAJOR Crypto News | Whales Accumulating, The Flippening Explained, & Bitcoin Market Manipulation"
350,Top Cryptos To Invest In RIGHT Now 2023
351,How to Buy $OMI Token (ECOMI) Full Tutorial
352,MASSIVE ALTCOIN SEASON IS BEGINNING | HOW TO PREPARE RIGHT NOW
353,ETH TO $3000? & My Thoughts On DOGE & SAFEMOON + CRYPTO REGULATION ?!
354,Is This Finally The Start Of The Crypto Winter Market Crash?
355,How To Profit This HUGE Altcoin Season (PREPARE NOW)
356,Crypto.com Review (2023): Full Beginners Guide & Everything You Need To Know
357,"6 AI Side Hustles To Start Today ($100,000+ Potential)"
358,The Next 100X Sandbox & Metaverse Micro Cap Gem (ALL IN)
359,"+10,000% Altcoin’s Will POP Soon"
360,How To INSTANTLY Increase Your Credit Score (Beginners Guide)
361,The PERFECT Stimulus Check Proposal?
362,how to survive & actually make millions in the next crypto bull run
363,$1200 IRS Stimulus Check Update
364,The 2023 Bitcoin Bull Cycle Just STARTED | Everything YOU NEED To Know
365,START Of Crypto SUPERCYCLE Market Recovery!?
366,How The Next Crypto Bull Run Will Make Us Millions
367,Does Money Really Buy Happiness
368,5 BEST CRYPTOS TO INVEST IN 2023
369,"MAJOR CRYPTO NEWS & +1,100% CRYPTO GEMS (HOW TO FIND & WARNING TO KNOW)"
370,"How To Get a FREE $10,000 Small Business Grant (DO THIS NOW)"
371,Unlocking the Full Power of Amex Points: Beginner's Edition
372,MAJOR CRYPTO DATES YOU NEED TO KNOW
373,CRYPTO CRASH WARNING
374,a cardano update 😳
375,Best Ledger Nano Devices | Full Beginners Guide (2023): Complete Setup & Tutorial
376,MASSIVE ALTCOIN SEASON STIRRING?! + AMC / GME SQUEEZE
