,title,video_id
306,Wednesday Morning AMC / GME Short Squeeze Live,186O3gAstSA
307,BRUTAL TRUTH OF SHIBA INU,-VPGLupMHoE
308,12 Cryptos That I'm Buying This Year,6LAwC_TQP-M
309,"10 Passive Income Ideas - How I Make $89,650 per Month",oP34uGPULxA
310,Top 4 MOST Underrated Crypto To Invest In 2021,42Dnof4whw0
311,SHIBA INU EXPOSED,BltWt29SbZs
312,STIMULUS CHECK UPDATE | DIRECT DEPOSIT WAVE 2 INCOMING!!,V3A6P9SL4vU
313,"HUGE Altcoin Season | Ethereum NEW $10,000 Price Target | DogeCoin Prediction",bmg7oj1_mjA
314,American Express Platinum Card 2023 Review | 10 Secret Benefits & Tips,nkvx5RXxKOU
315,"MY NEXT +80,000% ALTCOIN BET (IMPORTANT)",dKWH-Cp_zp8
316,Why Crypto Crashed & How To Profit Right NOW,SnWkT_J5d8s
317,The Solana & Cardano KILLER 😮,7tpSPVN4DJQ
318,$AMC $NKD $GME 🚀ROBINHOOD CLASS WARFARE,Wfp9PxCoUTQ
319,6 Profitable AI Businesses to Start Today (Recession-Proof),eeq2BX1fDFQ
320,You Only Need These 5 Credit Cards in Your Wallet ⌛,rJbOWqg81FA
321,How to Get the Amex Centurion Card (Black Card),A-wnYsAbDJ4
322,HOW TO INCREASE YOUR CREDIT SCORE FAST IN 2024,4sLFCHU3TD8
323,THE CRYPTO CRASH | WATCH NOW,x1hh5k8LSKo
324,"CRYPTO NEWS | Crypto Watchlist, End of Meme coins?! & MORE",yqqxsTDX5Kg
325,CRYPTO RECOVERY NEWS. THE TRUTH,cLJbKusCYZM
326,WARNING CRYPTO MARKET CRASH OR HUGE START TO SUPERCYCLE?!,h4gn2Rcvnt8
327,WHY THE CRYPTO BULL MARKET IS NOT OVER | HUGE GOOD NEWS!,j2_BE3NK0mY
328,Top 5 Cryptos to Invest In (GET IN EARLY),n3VopDgDgbg
329,Second Stimulus Check Officially Confirmed In The HEALS New Act,niy-cK7t6IU
330,The Absolute Power Of The American Express Trifecta,AWWwvNk32NM
331,How The Crypto Bull Run Will Start in 2024. Get Ready TODAY.,sfr0PuBGOPs
332,Stories of An AMEX Black Card Concierge | My Reaction,mO5NSR9bhWA
333,Amex Gold Card - 9 Secret Benefits & Tips (Full Guide),cVMIGhoEYO4
334,New ($2000) + $1000 Per Month Stimulus Debit Card Act,bEAbYZ0-iAA
335,How To Find The NEXT Shiba Inu,j24DYRjrghA
336,American Express Gold Card 2023 Review | 5 Secret Benefits & Perks,mCrz6PX3Jw0
337,The Coming Cardano Boom.,2QHE9_3HxFs
338,2 UNDERRATED CRYPTOS TO BUY NOW (800% Return),PXUbY0jDtpU
339,CRYPTO GAMING METAVERSE TOO LATE OR INVEST NOW?!,V9GD_QijUWE
340,My Next +900% Altcoin Bet,tik_9aAIr3Y
341,TOP 3 CRYPTO PASSIVE INCOME STRATEGIES | FULL GUIDE 2023,iCXVJ21q828
342,2 UNDERRATED CRYPTOS TO BUY NOW (800% Return),PXUbY0jDtpU
343,CRYPTO GAMING METAVERSE TOO LATE OR INVEST NOW?!,V9GD_QijUWE
344,My Next +900% Altcoin Bet,tik_9aAIr3Y
345,TOP 3 CRYPTO PASSIVE INCOME STRATEGIES | FULL GUIDE 2023,iCXVJ21q828
346,How I Made My First $100k at 20 Years Old,sCyuMoK27Bk
347,We need to talk… (Crypto Truth),s3ipTbk9-zI
348,How I Became A Millionaire AND YOU CAN TOO.,BKQS2IOqlvY
349,Phase 4 Stimulus Package Update | My Predictions,ENHu_yjgJK4
350,3 Passive Income Strategies With Crypto You NEED NOW,H-JGE_q_u6I
351,When Is The Second Stimulus Check Coming Out?,yDcC09kxaw8
352,The Next 100x Cardano Altcoin,ipQhbgTBWKM
353,The Next Cardano Explosion,EDSzToGvmwE
354,How to Get Massive Credit Limit Increases,bHD-kUUipxU
355,Paying Off My Mom's Credit Card Debt She Carried For Over 10 Years,RD85IiqukXA
356,"MAJOR Crypto News | Whales Accumulating, The Flippening Explained, & Bitcoin Market Manipulation",LHPsoYz4cl8
357,Top Cryptos To Invest In RIGHT Now 2023,5T2ERv6QmvM
358,How to Buy $OMI Token (ECOMI) Full Tutorial,UukGz9jpDvs
359,MASSIVE ALTCOIN SEASON IS BEGINNING | HOW TO PREPARE RIGHT NOW,JKDL8nxOWU0
360,ETH TO $3000? & My Thoughts On DOGE & SAFEMOON + CRYPTO REGULATION ?!,_vwf68603Rs
361,Is This Finally The Start Of The Crypto Winter Market Crash?,bR-tqzviX-A
362,How To Profit This HUGE Altcoin Season (PREPARE NOW),eWKLQNPgrDs
363,Crypto.com Review (2023): Full Beginners Guide & Everything You Need To Know,_H8LeKewmpQ
364,"6 AI Side Hustles To Start Today ($100,000+ Potential)",vPJHUYhSZmI
365,The Next 100X Sandbox & Metaverse Micro Cap Gem (ALL IN),TSlruJ3thBs
366,how to survive & actually make millions in the next crypto bull run,m_Bus4bRlxQ
367,How To INSTANTLY Increase Your Credit Score (Beginners Guide),gROkldpwhBE
368,"+10,000% Altcoin’s Will POP Soon",82Isb_FRaI0
369,The PERFECT Stimulus Check Proposal?,PlPrlESHLd0
370,$1200 IRS Stimulus Check Update,DUH7MUEYFpc
371,The 2023 Bitcoin Bull Cycle Just STARTED | Everything YOU NEED To Know,3Tf-wC22n3I
372,START Of Crypto SUPERCYCLE Market Recovery!?,M8xRgyu5P5s
373,How The Next Crypto Bull Run Will Make Us Millions,g4ozaJkI7CU
374,Does Money Really Buy Happiness,pllAQd6bC5s
375,5 BEST CRYPTOS TO INVEST IN 2023,J1obgVPSKZY
376,"MAJOR CRYPTO NEWS & +1,100% CRYPTO GEMS (HOW TO FIND & WARNING TO KNOW)",Ua6Uj20DpDg
377,"How To Get a FREE $10,000 Small Business Grant (DO THIS NOW)",k9-pSSXHIx0
378,Unlocking the Full Power of Amex Points: Beginner's Edition,-QxQfUQPgbs
379,MAJOR CRYPTO DATES YOU NEED TO KNOW,7MXF-7tzGTM
380,CRYPTO CRASH WARNING,uRIT4fEkDAM
381,a cardano update 😳,LiUECjhzhWM
382,Best Ledger Nano Devices | Full Beginners Guide (2023): Complete Setup & Tutorial,8VDiIRdi62o
383,MASSIVE ALTCOIN SEASON STIRRING?! + AMC / GME SQUEEZE,MmzAlPx9gvY
384,How To Research & Find 100X Crypto MOON SHOTS,urpOGsvFE6Q
385,The NEXT 2023 Crypto Crash Coming Soon?,xuSKwV5ePSU
386,"NEW $10,000 MONTH TOTAL STIMULUS CHECK BILL",R4qd-G8wLI0
387,GameStop & AMC Short Squeeze Explained | WHY IT'S STILL NOT TOO LATE,-0a-kCtTydo
388,Second Stimulus Check Update | Expected Date 😳,7aqKliWGpiQ
389,How To Outperform Cardano With These Sleeper Altcoins,HoCvmPA5LjI
390,My 7 Multiple Streams Of Income,jThL-AXPmAQ
391,BITCOIN BREAK OUT HAPPENING SOON!? HUGE CRYPTO NEWS AND DATA,VW1yxCL8DQo
392,THE CARDANO AFTERMATH.,W6ujkeBSA_U
393,PHASE 4 'HEROES ACT' Bill Passing TOMORROW ??,u0HeOU78HEw
394,The Incredible Power of the American Express Trifecta,Ff7Sj1KQcIw
395,Critical Message For Crypto Investors,_roHlUvV32o
396,"The Epic Ethereum Rally to $10,000",dBBEI270-uY
397,CRYPTO FLASH CRASH & HOW TO WIN THE MARKET,bmemTR7VE0E
398,How To TRIPLE Your AMEX Credit Limit,6n-BW9w0fn0
399,Stimulus Check Update | Why You Still Haven't Received Your Direct Deposit,tLxyjLe1FUw
400,How To Make Money in a Crypto Flash Crash,RG4OVfl7G0k
401,HISTORIC ALTCOIN SEASON & DEATH OF CARDANO?!,DhIcLfZM34U
402,Clearvalue Tax vs Meet Kevin (it's serious now),GH9X3Xa_JW8
403,GIANT 500% Altcoin Rally / Crypto Market Cap HUGE Glitch / MLB & Crypto Partnership,cJOlk92BwTg
404,"FTX Collapse, Explained",3NdNtBTPLF4
405,Stimulus Check Drama Update | Meet Kevin v.s ClearValue Tax,BvqFdbn_wkU
406,"LARGEST CRYPTO SCAM EVER / 12,000% ALTCOINS PUMPING NOW / ROBINHOOD SUED & HUGE CRYPTO NEWS",R4zc4-V9BVM
407,3 Ways To Build Wealth in This Recession,QbJEF4KiKgM
408,$AMC Squeeze & Crypto Market Price Updates | Wyckoff Method & How To Prepare NOW,0cYb9SMn5HQ
409,TOP 5 CRYPTOS TO INVEST IN 2023,hfXTz0U1lSQ
410,"Beginner's Guide to Affiliate Marketing | $32,437 per Month Passively",c0bsG_LbtUA
411,Amex Gold Card In-Depth Review 2021 (Still Worth?),D-Cuja1Sgnk
412,Growing my Crypto Portfolio to $1M (Episode 1),kHalbHn_Zcc
413,American Express Platinum Full Review & Card Benefits,N7Cfmkj6GO0
414,MAJOR CRYPTO NEWS / THE FEDS STATEMENT TODAY / HUGE NFT WHALE MOVES & BTC DEATHCROSS OR WYCKOFF?,PDNwSD6hzW0
415,GOLDEN CROSS ALTCOINS TO WATCH NOW!,WDrHvPZFKw0
416,TOP 3 Second Stimulus Check Updates | Finally Some Good News!,SqJfGed2bRc
417,Expected SOON $1200 Checks?! Second Stimulus Check Update,1de5rSGEYVk
418,It’s Over.,nsN3IYPsPlw
419,MASSIVE BITCOIN REBOUND | HUGE CRYPTO NEWS COMING,pNFfyQrh_A8
420,My Modern Apartment Tour 2021,k4RMZjKBCxw
421,MAJOR BITCOIN BREAKOUT SIGNALS & ALTCOIN BLOODBATH STRATEGY,px98qf4Kgs8
422,$2000 STIMULUS CHECK BILLS REALLY DEAD??,RoSyABCZnhk
423,$1800 Per Month Stimulus Check | Coming Soon? 😲,RGtgvlPDL0k
424,+400% ALTCOIN RISING & HOW TO DISCOVER THEM NOW,HHPorAxmC3E
425,American Express Blue Cash Everyday & Preferred 2021 | The Most Underrated Credit Card,JabwekOvY24
426,IS BITCOIN REALLY FINISHED?!  | WATCH NOW,vOaPmbU1-As
427,Crypto Bear Market Explained (IMPORTANT),oDyhl8jyjw4
428,BITCOIN SPRING COMING SOON? & ELON MUSK TWEETS AGAIN!,ze7CP_8r3LU
429,Second $1200 Stimulus Check APPROVAL Success Chances & Odds,IZ_S54IOQIo
430,Second Stimulus Bill | $2000 a Month Payment Gaining Momentum?,AHSjCaKArsI
431,Second Stimulus Check Update: Are We Going To Get A Second Round?,f5RvlG5dMzU
432,2023 GOLDEN CRYPTO EXIT STRATEGY REVEALED🔥😳,sCKk8zopOmQ
433,TOP 3 HOTEL CREDIT CARDS YOU NEED | HOTEL TRIFECTA 2019,hAphLwpFZn0
434,GOING ALL IN ON ETHEREUM,Z0oiO6e8F60
435,HUGE CRYPTO NEWS & BITCOIN BANNED IN UK,QQ4C_7PsrR0
436,The Platinum Card® from American Express MAJOR Updates | Still Worth It?,gEJcHTs1Ipo
437,The Best Travel Credit Card (Amex Platinum),vv5JrRngg1Q
438,My Top 5 Crypto Picks,G4bwmXQTbFU
439,FULL DETAILS: SECOND STIMULUS CHECK CONFIRMED + $600 UNEMPLOYMENT BOOST,-Ak92yW3suI
440,I Almost Got Stabbed,N-35KcRV3m0
441,Bitcoin Conference / Wyckoff Phase B / Huge Crypto News,L8QwNqzg7Wo
442,Bitcoin for Beginners: Bitcoin Explained in Simple Terms,UlKZ83REIkA
443,Bitcoin Explained in the Bitcoin Basics Workshop CBP Prep [Free Workshop Extras - See Description],FYo5E7zT-vM
444,Escaping the Global Banking Cartel - Bitcoin as an Exit,LgI0liAee4s
445,The Stories We Tell About Money,ONvg9SbauMg
446,"Consensus Algorithms, Blockchain Technology and Bitcoin UCL - by Andreas M. Antonopoulos",fw3WkySh_Ho
447,Libre Not Libra: Facebook's Blockchain Project,7S6506vkth4
448,Bitcoin Q&A: Will Governments Ban Cryptocurrencies?,LIQkuF_I5Xo
449,Cryptocurrency Explained: Money as a System-of-Control,FyK4P7ZdOK8
450,Beyond Price: Bitcoin's Impact on the Future,rvwVbRQ5Ysc
451,Bitcoin Q&A: Misconceptions about Lightning Network,c4TjfaLgzj4
452,Cryptocurrency Explained: All the ships are sinking (Currency Wars II),stN03wk_Wzs
453,Bitcoin Q&A: How Do I Secure My Bitcoin?,vt-zXEsJ61U
454,Bitcoin and the Coming Infrastructure Inversion: ReMastering Series [2020],KXIaILHl7Rg
455,"Fake News, Fake Money - Classic Bitcoin Talk",i_wOEL6dprg
456,The Internet of Money: Five Years Later,6xIq0FdmsIA
457,Bitcoin Q&A: Energy Consumption,2T0OUIW89II
458,Bitcoin and the Banks - Five Stages of Grief by Andreas M. Antonopoulos,43Ucj6_Erb0
459,"Bitcoin Halving 2024: How It's Different This Time, Myths Debunked, Bitcoin Bugs, and More",vwkRsp0gqX4
460,Blockchain for Beginners,i9nUMvpT2rM
461,"""Blockchain"" or Bitcoin: Understanding the Differences",mRQs9Y6CUSU
462,The Killer App: Bananas on the Blockchain?,H_kyYrbBY1I
463,"What US Taxpayers With Crypto NEED to do before Dec 31, 2024 - Get into the Safeharbor!",M1XPOFgjNPk
464,Bitcoin Q&A: How Much Bitcoin Do You Have?,DJtM9mR7cOU
465,Bitcoin Q&A: The 21 Million Supply Cap,AABkJ55Zz3A
466,"Cryptocurrency Explained: Understanding ""Double-spend"", Block Re-Organization, & Consensus [Bitcoin]",hixM4u7ep58
467,Bitcoin Q&A: Who is Satoshi Nakamoto?,1iEv-gUZNx4
468,Bitcoin Q&A: Hot vs. Cold Wallets,Aji_E9sw0AE
469,Ethereum Q&A: DeFi Explained in 4 minutes,RxrqNmv2tR0
470,Bitcoin Q&A: How Do I Choose a Wallet?,tN6b62sEpsY
471,Bitcoin Q&A: Lightning and Onion Routing,D-nKuInDq6g
472,Please Explain Bitcoin to My Mother! [A non-technical explanation of bitcoin anyone can understand],1wDwb36GNxw
473,Bitcoin Q&A: What is the Role of Nodes?,fNk7nYxTOyQ
474,Bitcoin Q&A: What Will Be The Effect Of The 2020 Halving?,2TiAPAYY0NA
475,WORST Ways to Store Bitcoin [3 Mistakes to Avoid],x6rnAGscBrU
476,"For the Last Time, Stop Using Paper Wallets!",iNHVbDtUL0E
477,Bitcoin Q&A: Key Storage Best Practices,A5I55aOgX2o
478,What is Consensus: Rules without Rulers,2tqo7PX5Pyc
479,Bitcoin and Unstoppable Code: The Difference Between Can't and Won't,Q6euy5W1js4
480,A Technical Introduction to The Lightning Network - We Are Developers 2020,E1n3sKKPD_k
481,Advanced Bitcoin Scripting -- Part 1: Transactions & Multisig,8FeAXjkmDcQ
482,Bitcoin is Punk Rock - Deal With It!,_0mykANOMGQ
483,Bitcoin Security: Bubble Boy and the Sewer Rat,810aKcfM__Q
484,Ledger Recover: What The Hell is Happening? With aantonop and lopp.,9scIevuymZM
485,Lightning Network: what is it? why should I care? what can I do with it? Enjoy bitcoin like its 2013,AYAreuNzx58
486,Another Brick in the Firewall,tohIX-m4ZD8
487,Non-Technical: Lightning Network Explained,XCSfoiD8wUA
488,Price Volatility: Who Determines the Value of Bitcoin and Other Cryptocurrencies?,DucvYCX1CVI
489,Bitcoin Q&A: How Do Mnemonic Seeds Work?,wWCIQFNf_8g
490,"Running Your Own Bitcoin Node, Ethereum Node, Lightning Network Node - aantonop Q&A",AXUfwvhr3lg
491,Bitcoin Q&A: My Response to Jamie Dimon,1dEcdGc0tIo
492,Bitcoin Q&A: What is a Private Key?,xxfUpIV9wRI
493,Bitcoin Q&A: Why is Seed Splitting a Bad Idea?,p5nSibpfHYE
494,Immutability and Proof-of-Work - the Planetary Scale Digital Monument - classic Bitcoin talk,rsLrJp6cLf4
495,The Courage to Innovate Without Permission,ywq6NBETUJ8
496,Measuring Success: Price or Principle,mPMsbgWl9p4
497,"Can Someone Guess My Crypto Private Key? [From Sand, to Molecules, to the Observable Universe]",2eZ5DP2P5As
498,Attacks on Bitcoin? Don't Worry; Bitcoin is Unstoppable! (But that doesn't mean we'll do nothing),7EnmlzbocEU
499,Is bitcoin in a bubble? Cryptocurrency taxes? Stablecoins? Jan Q&A Livestream - aantonop,j1ckIU1zql8
500,Ethereum Q&A: ICOs and Pyramid Schemes,8HYWWP1QU7Q
501,"The Crypto Airplane: understanding cryptocurrency ownership [bitcoin, ethereum]",tYldJpSPeqg
502,Bitcoin Q&A: Can You Trust a Hardware Wallet to Generate Your Seed?,cONG2ZNjJ0c
503,MultiSig is NOT the best option for most people to store their bitcoin [June 2023],sjS5qF65Yos
504,Bitcoin Q&A: Geopolitics and State-Sponsored Attacks,htxPRTJLK-k
505,"Bitcoin Q&A: Proof-of-Work (PoW), Proof-of-Stake (PoS), Delegated Proof-of-Stake (DPoS)",3W_3AQrQEOM
506,Why Open Blockchains Matter,uZPIz3ArQww
507,Bitcoin - Keeping Digital Communities Weird,1MG1aR71uFg
508,"Embrace the Good, Reject the Fear",38U0BQQLzK0
509,Picking the Right Blockchain for the Job,JIJbPoofaWA
510,Crypto Security: Passwords and Authentication - Livestream aantonop,m8jlnZuV1i4
511,Will Bitcoin Fail to Scale?,bFOFqNKKns0
512,I Can't Afford One Bitcoin! What Can I Do? (SOB#457),KoakvSVKz1E
513,Bitcoin Q&A: Decentralised Exchanges and Counterparty Risk,hi_jaw0dT9M
514,"New Bitcoin & Cryptocurrency Exchange Regulations in the US [""Self-Hosted"" Wallets Unaffected]",Jh0hocs-_PA
515,Decentralized Globalization: Cryptocurrencies are Superpowers for Everyone,QoiR4aNbTOw
516,"Bitcoin, Lightning, and Streaming Money",gF_ZQ_eijPs
517,Security vs. Complexity,M82t5wZG3fc
518,Bitcoin Q&A: Will Governments Let Privacy Coins Exist?,30sjEW70rLE
519,Bitcoin Q&A: Is Multi-sig for the Average User?,nRts1VWkOXQ
520,Bitcoin Q&A: Atomic Swaps,fNFBA2UmUmg
521,Privacy and Scale - Everything you need to know about Bitcoin's Taproot (SOB#455),_dqDP1qZHd4
522,"March Q&A - $7B Bitcoin Takeover, Taproot, Bitcoin Energy Consumption, NFT, LN Wallets + More [2021]",U0T49duRt74
523,The Real Truth About Bitcoin's Energy Usage,xoEId1UEsG4
524,Andreas M. Antonopoulos testimony for Australian Senate,XotOwt8bTeI
525,Unprecedented: Rules without Rulers [a new governance model humanistic globalization],gq-t7Ky6QmE
526,How Chris Lost His Bitcoin & How You Can Avoid Doing The Same - June 2023,P1Mi608a318
527,Bitcoin Q&A: The Rules of Bitcoin (Part 1),VnQu4uylfOs
528,Will There Be More Than 21 Million Bitcoin?,l6-yi72brk8
529,"A False Narrative: White Markets, Black Markets",ffmu6t7PtO0
530,Bitcoin Q&A: What is Segregated Witness?,dtOjjB4mD8k
531,Bitcoin and Open Blockchain Livestream Q&A with Andreas M. Antonopoulos - May 2022,kwweNe-lPas
532,Bitcoin Design Principles - IDEO Lab presentation by Andreas M. Antonopoulos,Ur037LYsb8M
533,Bitcoin Q&A: Price Premiums and Arbitrage,B4tsk-ZiHuE
534,Bitcoin Q&A: Wealth Distribution Statistics,X2Qsz4eaSPY
535,Bitcoin Q&A: Governments vs. Proof-of-Work or Proof-of-Stake,qrwgYDAoZV0
536,"Bitcoin: Dumb Networks, Innovation and the Festival of the Commons",x8FCRZ0BUCw
537,Slush17 Panel: Farewell to Centralised Data,ul0aGzF-v5c
538,Bitcoin Q&A: Could Governments Take Over Exchanges?,9PrJQeKl9w4
539,Bitcoin Q&A: What is Mining?,t4p4iMqmxbQ
540,Bitcoin Price Obsession- ReImagined,ghyaFr7ikEY
541,Bonus Livestream Session - Ethereum Basics,MYOvvOyStvg
542,Bitcoin is Power - Power is Everything (SOB#456),cNWLZDvCkOs
543,Do You Run a Bitcoin Full Node? [Monthly Costs & Basic Node Configuration in 2 Min],lK-OMq43nxA
544,Bitcoin: Where the Laws of Mathematics Prevail,HaJ1hvon0E0
545,Bitcoin Q&A: Will Bitcoin Become the World's Reserve Currency?,ctz4E5Z21No
546,"Bitcoin Q&A: SegWit, Scaling, and Consensus",Jc7mrR6AAto
547,Bonus Livestream Session - The Halving,nXwiG783A5A
548,Bitcoin Q&A: Bitcoin vs. Blockchain,kHbtp7pOftU
549,"Ethereum Q&A: ICOs, Disruption, and Self-regulation",yfjgcI8xX3A
550,LTB Live - Ethereum: Consensus vs Immutability,OGGW9ozE-ys
551,Bitcoin Q&A: Altcoins and Specialisation,b_Yhr8h6xnA
552,Bitcoin Q&A: Hyperbitcoinization,AB5MU5fXKfo
553,Investing in DeFi? You Need to Know the 5 Categories of Risks You're Facing [2021],OxNXBhmtDrw
554,Bitcoin Q&A: Where Can I Buy and Spend Bitcoin?,RPR5dtmXnY8
555,Why Is the IMF Afraid of Cryptozation? (Part I of II),fJ4AbIAxzEw
556,"Ethereum, ICOs, and Rocket Science",OWI5-AVndgk
557,"Interview: Bitcoin, Blockchain, and Beyond",jNnll0L7n-c
558,Should I Update the Firmware on My Hardware Wallet? Cryptocurrency Security Explained,w2pkWKFeqto
559,Bitcoin 101 - Introduction to the Future of Money,3MLy5Z5ISeA
560,Bitcoin Q&A: Why Developers are Leaving Banks,GqOZ4IAQ-xQ
561,Bitcoin Q&A: Criminalization of Ownership?,5xihdO7bVZE
562,Ethereum Q&A: Altcoins and the Scaling Debate,slbpdW-H3yk
563,"Crypto Explained: Taproot Drawbacks, Bitcoin Energy Usage, Ethereum FEES!!! + more [May 2021]",5bY4D33o5SU
564,Buying Bitcoin Using Dollar Cost Averaging & Avoiding Dust UTXO - Self Custody Series - Feb 2024,gwABJO-kaM8
565,"Bitcoin Q&A: SegWit, Schnorr, Taproot, and Graftroot",nf_GCdCaQww
566,Crypto Key Management and Hardware Wallets: Bonus Livestream Session,bc3HQqCSl7A
567,Bitcoin Q&A: Futures Markets,vGz22l1FZEM
568,Bitcoin Q&A: What is the Appeal of Sound Money?,tfba4FFErrQ
569,Bitcoin Q&A: The Game Theory of Staking,MHYS0xgZ9dQ
570,Ethereum Q&A: Initial Coin Offerings (ICOs),Q5R8KuxV4A0
571,Bitcoin Q&A: The Lightning Network,vPnO9ExJ50A
572,Bitcoin Q&A: Migrating to Post-Quantum Cryptography,dkXKpMku5QY
573,Bitcoin Energy Consumption & Climate Change: Does Bitcoin Use Too Much Energy? [2021],eTqKLJ_o9yQ
574,Bitcoin Q&A: Borderless Money,EZh1-ZqffOw
575,Cryptocurrency Explained: What is a Mnemonic phrase? [Understanding Bitcoin Ethereum Crypto Keys],pIvgjCvGlwo
576,Ethereum Q&A: The ICO Token Explosion,vdaW8NtJXuQ
577,Bitcoin Q&A: CME Bitcoin Reference Rate,RVwNMI0NWT0
578,"Bitcoin, Payment Security, and Consumer Protection",qMkGfB8X58o
579,"Official Cowards, Financial Scatology & Precursors to Hyperinflation (SOB 468)",_UAGDB-rvjc
580,Cryptocurrency Explained: How to Get More Privacy on Bitcoin Transactions [Privacy is a Human Right],JN1Bowgcle8
581,"Gamestop, Wall Street and the Avocado Toast Revolution (SOB#452)",s5-FCS1-2RI
582,Bonus Livestream Q&A - DeFi,TAKZD1txBmI
583,Bitcoin Q&A: MimbleWimble and Dandelion,LjDJGTpK_lE
584,Bitcoin Q&A: The Rules of Bitcoin (part 2),vtIp0GP4w1E
585,Bitcoin Q&A: The Internet Will Eat Your Business,DXLZSgf4b8Q
586,Bonus Livestream Session - DeFi (Decentralized Finance),zEkXIcBKK9c
587,"LTB: TheDAO, TheFork, TheFallout",Swdb-Z_4JmI
588,How and Why Governments Lie About Inflation (SOB 471),15beIVhFqX4
589,"Bitcoin Q&A: CoinJoin, Privacy, and Network Bifurcation",soeFxWkM5qI
590,Bitcoin Q&A: Job Opportunities with Cryptocurrencies,89_p4pDlQtI
591,Bitcoin Q&A: What Happens During a Fork?,XBk8hBJ1xVo
592,Bitcoin Q&A: Bitcoin as Everyday Currency,xYvvSV4mjH0
593,Bitcoin Q&A: The Price of Losing Privacy,2G8IgiLbT_4
594,"Bitcoin Q&A: ""Blockchain, not Bitcoin""",r2f0HlaRdgo
595,"Dogecoin, Crack up Booms and the Modern Mania",bmJfwghJwQE
596,Ledger Hack: Who is Ledger? What Happened? Does the Ledger data breach affect everyone?,qd6kBbpQ22Y
597,"ReMastering - Bitcoin & the Elements of Trust: how do chemistry, cooking, & lego relate to bitcoin?",Nst2MCLBSZQ
598,"Paper wallets, inflation, criminals using bitcoin and...Bitcoin & Open Blockchain Livestream [2021]",MbwLVok4gWA
599,Breaking Up with Your Bitcoin Wallet: How Do You Move From One Cryptocurrency Wallet to Another?,oVjs63cu6eo
600,Bitcoin Q&A: Central Bank Digital Currencies (CBDCs),dEPP0m6681s
601,Bitcoin: A New Species of Money - An Evolutionary Perspective on Currency,G-25w7Zh8zk
602,Bitcoin Q&A: Is Bitcoin a Good Investment?,y6egEeOSgjI
603,Bitcoin Q&A: Unspent Transaction Output (UTXO),ZCsakXHiwlw
604,Bitcoin Q&A: Important Terminology Explained,cZOiFtkuIOU
605,Bitcoin Q&A: HODL strategies and their drawbacks,nJFp2ItGKVs
606,"Bitcoin Q&A: Someone Said Bitcoin is ""Dead"". What Do You Say?",_osg3W7VI-Q
607,"GameStop, DeFi, the Queen's Gambit & More  [Bitcoin Ethereum Crypto Open Topic Q&A] - January 2021",UNA6s4Z78vw
608,Bitcoin Elements of Trust: Unleashing Creativity With Building Blocks of Trust,uLpSM3HWU6U
609,My First Bitcoin Talk on Bitcoin Neutrality From 2013,EiW4lKrMXQ4
610,"Learn About Bitcoin Taproot Activation & See the Numbers for Yourself [May 23, 2021]",jUwqFkPAoNY
611,Bitcoin Q&A: Why I Earn Bitcoin Instead of Buying It,Ci7TyD8jETY
612,ReMastering The Lion & the Shark: Bitcoin vs Ethereum: Divergent Evolution in Cryptocurrency,y-S8hOQIBnI
613,Bitcoin Q&A: We All Started as Critics,-jvefuVRwYA
614,Bitcoin Q&A: Intrinsic vs. Extrinsic Assets,KDtfFNZy9xg
615,Bitcoin Q&A: Schnorr Signatures and the Privacy Roadmap,JeJzwZgxF50
616,Canadian Senate Testimony on Bitcoin,GP_eT6E4os8
617,"Bitcoin security, NFTs, El Salvador's Volcano Bond, and more!  - December 2021 Q&A",BR6sQgjwE3Y
618,Open Blockchains for Cashless Developed Economies,eo-0BgrKxiI
619,Ethereum Q&A: How Do Smart Contracts Work?,DyAjgkwwgyI
620,Your Crypto Safehouse: Why Your Bitcoin Isn't Lost if Your Hardware Wallet Breaks,s-aGTK5da4Q
621,Speaking Of Bitcoin - Let's Talk About Bitcoin Transaction Fees!,JHUjC6gqJoA
622,Bitcoin Q&A: From Barter to Abstract Money,KYsppZoHguQ
623,"Bitcoin Q&A: Monetary Crisis, Law, and Supply Capture",cDdUU_ym46c
624,Rabbit Hole -  What Should You Use if a Hardware Wallet Isn't an Option for You?,QGKJ_zvzOlU
625,Bitcoin Q&A: What is the Biggest Threat?,1-XUbH1F0Os
626,"Bitcoin Q&A: Not your Keys, Not your Coins",AcrEEnDLm58
627,Bitcoin Q&A: Re-using Addresses,4A3urPFkx8g
628,Bitcoin Q&A: How is a Multisig Address Created?,Vhedu2XD3hU
629,"Bitcoin Q&A: M-Pesa, Warren Buffet, and USD Domination",uPr2lFOsPms
630,Bitcoin Q&A: Operating a Business with Cryptocurrency,pa447maMFLQ
631,"Crypto Wallets, Backup, & Recovery: What is a Crypto Wallet Derivation Path?",p_SJKiff5Ng
632,Ethereum Q&A: ICOs and Responsible Investment,C8UdbvrWyvg
633,Bitcoin Q&A: Mixing services,rKoMvOH4zoY
634,Why Cryptoization Scares the IMF (Part II),_PJIlianiJg
635,Bitcoin and Open Blockchain Livestream Q&A with Andreas M. Antonopoulos - March 2022,rDxUcCTGw1Q
636,"Announcing ""Mastering the Lightning Network""",julWo8IJX_8
637,Ethereum Q&A: Does Ethereum Compete Against Bitcoin?,LK0Q3CTUFDQ
638,Bitcoin Q&A: What Happens to Transaction Fees when the Block Reward is Zero?,FffX32ENGKc
639,Bitcoin Q&A: Could a State-sponsored 51% Attack Work?,KUd8ZGgm6Qo
640,What Is the Definition of Turing Complete? #Bitcoin and #Cryptocurrency Q&A,Vm8tneHM-x4
641,Bitcoin Q&A: The Obsoletion of Legacy Systems,ZxGbUuOqQsI
642,🚨 BITCOIN EXTREME ALERT!!!!! CRITICAL MOMENT UNFOLDING!!!! WAKE UP!!!!! 🚨,bO9paxO8zmQ
643,OMG!!! IT’S FINALLY HAPPENING TO BITCOIN! WARNING!!! THIS DUMP IS A DISTRACTION!🚨,egD_kOJBIVE
644,BITCOIN BOUNCE WARNING!!! WATCH THIS BEFORE YOU BUY!!!! [this can’t be real... right?],JkbUJDugVCg
645,🚨 BITCOIN ALERT!!!! BLACKROCK’S SECRET MEETING!!! YOU WON’T BELIEVE WHAT’S ABOUT TO HAPPEN!!! 🚨,-5TReI70eok
646,Bitcoin. I’m Speechless…,TZ3f8uNbWZU
647,🔴 BITCOIN PANIC!!!! SELL-OFF CONTINUES!!! HOW BAD IS IT REALLY?!  [brutally honest],_S6OyE7uGI4
648,🚨 ALERT!!! BUY BITCOIN NOW!!!!!! THIS IS UNHEARD OF!!!! [ I’ve never been so bullish! ],s7_AACViDpo
649,URGENT!!! BITCOIN HAS DONE THIS EXACTLY BEFORE!!!! THIS CHANGES EVERYTHING!!!! [watch fast],4jecCy7YSpI
650,BITCOIN WILL HIT 10 MILLION DOLLARS & There’s NOTHING Anyone Can Do To Stop It!,uvmXFk14YZs
651,"BITCOIN SIGNAL CALLED EVERY BOTTOM!! FLASHING GREEN NOW!! 14,922 BTC WHALE MOVE!!!",fAx22xq167E
652,BITCOIN: WHAT IF EVERYONE IS WRONG?!!! … AND *THIS* HAPPENS INSTEAD!!!!! 🚨 [WHAT WOULD YOU DO?],ogABrv6Tu58
653,🚨 BITCOIN HODLERS PREPARE!!!!! THIS WILL CHANGE EVERYTHING!!! [time running out] 🚨,3xwb8Wpo8O0
654,THE BITCOIN GAME HAS CHANGED!!! FORGET EVERYTHING YOU KNOW!!! [groundbreaking data revealed],q9f_NmcLIp4
655,BITCOIN BREAKOUT!!!? Goldman Sachs BTC Client Call LEAKED!! BULLISH INDIA NEWS 🚀,gixKgozoCAY
656,"HOLY SH!!T!!! BITCOIN SMASHES $30,1,2,3K!!! WARNING: LIQUIDITY SQUEEZE IMMINENT!!!!",c5XsrwTaoFQ
657,BITCOIN Winding UP for NEXT MAJOR RUN!!? Why BILLIONAIRES Are BUYING Right NOW!!,--swStNGLYA
658,BITCOIN PULLBACK!!!!! WAIT…. SOMETHING MONUMENTAL IS HAPPENING RIGHT NOW!!!!,b3cXrhQR25I
659,BITCOIN!!! I’m Sorry… But This ABSOLUTELY MUST BE SAID!!! [DON’T Ignore for 2023] 🚨,qJlu60A8v78
660,🚨 BITCOIN!!! ARE YOU READY FOR THIS?!! [PROOF] THINGS ARE ABOUT TO SPIRAL OUT OF CONTROL!!!!!,BgT0JNiySKc
661,BITCOIN HISTORIC WTF?!?! THIS HAS NEVER HAPPENED BEFORE!!!!!🚨[ I feel very sorry for the bears…],G7n9CGhaYO4
662,"BITCOIN!!!!! I’M SORRY, BUT SOMEBODY HAS TO SAY IT… [REAL TALK]",TQFQesa-oKQ
663,ELON MUSK PUMPING BITCOIN!!!! $65k MOON SHOT!!! THE REVOLUTION HAS JUST BEGUN!!!,diEVyU6si1Y
664,BITCOIN ALERT: IT’S ACTUALLY HAPPENING! WHALES MOVE BILLIONS!!!! [guess who?] 🚨,xPHZqDK86n4
