,title
377,How To Research & Find 100X Crypto MOON SHOTS
378,The NEXT 2023 Crypto Crash Coming Soon?
379,"NEW $10,000 MONTH TOTAL STIMULUS CHECK BILL"
380,GameStop & AMC Short Squeeze Explained | WHY IT'S STILL NOT TOO LATE
381,Second Stimulus Check Update | Expected Date 😳
382,How To Outperform Cardano With These Sleeper Altcoins
383,My 7 Multiple Streams Of Income
384,BITCOIN BREAK OUT HAPPENING SOON!? HUGE CRYPTO NEWS AND DATA
385,PHASE 4 'HEROES ACT' Bill Passing TOMORROW ??
386,Critical Message For Crypto Investors
387,The Incredible Power of the American Express Trifecta
388,"The Epic Ethereum Rally to $10,000"
389,CRYPTO FLASH CRASH & HOW TO WIN THE MARKET
390,How To TRIPLE Your AMEX Credit Limit
391,Stimulus Check Update | Why You Still Haven't Received Your Direct Deposit
392,How To Make Money in a Crypto Flash Crash
393,Clearvalue Tax vs Meet Kevin (it's serious now)
394,GIANT 500% Altcoin Rally / Crypto Market Cap HUGE Glitch / MLB & Crypto Partnership
395,"FTX Collapse, Explained"
396,Stimulus Check Drama Update | Meet Kevin v.s ClearValue Tax
397,"LARGEST CRYPTO SCAM EVER / 12,000% ALTCOINS PUMPING NOW / ROBINHOOD SUED & HUGE CRYPTO NEWS"
398,3 Ways To Build Wealth in This Recession
399,$AMC Squeeze & Crypto Market Price Updates | Wyckoff Method & How To Prepare NOW
400,TOP 5 CRYPTOS TO INVEST IN 2023
401,"Beginner's Guide to Affiliate Marketing | $32,437 per Month Passively"
402,Amex Gold Card In-Depth Review 2021 (Still Worth?)
403,Growing my Crypto Portfolio to $1M (Episode 1)
404,American Express Platinum Full Review & Card Benefits
405,MAJOR CRYPTO NEWS / THE FEDS STATEMENT TODAY / HUGE NFT WHALE MOVES & BTC DEATHCROSS OR WYCKOFF?
406,GOLDEN CROSS ALTCOINS TO WATCH NOW!
407,TOP 3 Second Stimulus Check Updates | Finally Some Good News!
408,Expected SOON $1200 Checks?! Second Stimulus Check Update
409,It’s Over.
410,MASSIVE BITCOIN REBOUND | HUGE CRYPTO NEWS COMING
411,My Modern Apartment Tour 2021
412,MAJOR BITCOIN BREAKOUT SIGNALS & ALTCOIN BLOODBATH STRATEGY
413,$2000 STIMULUS CHECK BILLS REALLY DEAD??
414,$1800 Per Month Stimulus Check | Coming Soon? 😲
415,+400% ALTCOIN RISING & HOW TO DISCOVER THEM NOW
416,American Express Blue Cash Everyday & Preferred 2021 | The Most Underrated Credit Card
417,IS BITCOIN REALLY FINISHED?!  | WATCH NOW
418,Crypto Bear Market Explained (IMPORTANT)
419,BITCOIN SPRING COMING SOON? & ELON MUSK TWEETS AGAIN!
420,Second $1200 Stimulus Check APPROVAL Success Chances & Odds
421,Second Stimulus Bill | $2000 a Month Payment Gaining Momentum?
422,Second Stimulus Check Update: Are We Going To Get A Second Round?
423,2023 GOLDEN CRYPTO EXIT STRATEGY REVEALED🔥😳
424,TOP 3 HOTEL CREDIT CARDS YOU NEED | HOTEL TRIFECTA 2019
425,GOING ALL IN ON ETHEREUM
426,HUGE CRYPTO NEWS & BITCOIN BANNED IN UK
427,The Platinum Card® from American Express MAJOR Updates | Still Worth It?
428,The Best Travel Credit Card (Amex Platinum)
429,My Top 5 Crypto Picks
430,FULL DETAILS: SECOND STIMULUS CHECK CONFIRMED + $600 UNEMPLOYMENT BOOST
431,I Almost Got Stabbed
432,Bitcoin Conference / Wyckoff Phase B / Huge Crypto News
433,The Next 2023 Memecoin Explosion
434,The Crypto Bull Run Just Started | DO THIS NOW.
435,Bitcoin for Beginners: Bitcoin Explained in Simple Terms
436,Bitcoin Explained in the Bitcoin Basics Workshop CBP Prep [Free Workshop Extras - See Description]
437,Escaping the Global Banking Cartel - Bitcoin as an Exit
438,The Stories We Tell About Money
439,"Consensus Algorithms, Blockchain Technology and Bitcoin UCL - by Andreas M. Antonopoulos"
440,Libre Not Libra: Facebook's Blockchain Project
441,Bitcoin Q&A: Will Governments Ban Cryptocurrencies?
442,Cryptocurrency Explained: Money as a System-of-Control
443,Beyond Price: Bitcoin's Impact on the Future
444,Bitcoin Q&A: Misconceptions about Lightning Network
445,Cryptocurrency Explained: All the ships are sinking (Currency Wars II)
446,Bitcoin Q&A: How Do I Secure My Bitcoin?
447,Bitcoin and the Coming Infrastructure Inversion: ReMastering Series [2020]
448,"Fake News, Fake Money - Classic Bitcoin Talk"
449,The Internet of Money: Five Years Later
450,Bitcoin Q&A: Energy Consumption
451,Bitcoin and the Banks - Five Stages of Grief by Andreas M. Antonopoulos
452,"Bitcoin Halving 2024: How It's Different This Time, Myths Debunked, Bitcoin Bugs, and More"
453,Blockchain for Beginners
454,"""Blockchain"" or Bitcoin: Understanding the Differences"
455,The Killer App: Bananas on the Blockchain?
456,"What US Taxpayers With Crypto NEED to do before Dec 31, 2024 - Get into the Safeharbor!"
457,Bitcoin Q&A: How Much Bitcoin Do You Have?
458,Bitcoin Q&A: The 21 Million Supply Cap
459,"Cryptocurrency Explained: Understanding ""Double-spend"", Block Re-Organization, & Consensus [Bitcoin]"
460,Bitcoin Q&A: Who is Satoshi Nakamoto?
461,Bitcoin Q&A: Hot vs. Cold Wallets
462,Ethereum Q&A: DeFi Explained in 4 minutes
463,Bitcoin Q&A: How Do I Choose a Wallet?
464,Bitcoin Q&A: Lightning and Onion Routing
465,Please Explain Bitcoin to My Mother! [A non-technical explanation of bitcoin anyone can understand]
466,Bitcoin Q&A: What is the Role of Nodes?
467,Bitcoin Q&A: What Will Be The Effect Of The 2020 Halving?
468,WORST Ways to Store Bitcoin [3 Mistakes to Avoid]
469,"For the Last Time, Stop Using Paper Wallets!"
470,Bitcoin Q&A: Key Storage Best Practices
471,What is Consensus: Rules without Rulers
472,Bitcoin and Unstoppable Code: The Difference Between Can't and Won't
473,A Technical Introduction to The Lightning Network - We Are Developers 2020
474,Bitcoin is Punk Rock - Deal With It!
475,Advanced Bitcoin Scripting -- Part 1: Transactions & Multisig
476,Bitcoin Security: Bubble Boy and the Sewer Rat
477,Ledger Recover: What The Hell is Happening? With aantonop and lopp.
478,Lightning Network: what is it? why should I care? what can I do with it? Enjoy bitcoin like its 2013
479,Another Brick in the Firewall
480,Non-Technical: Lightning Network Explained
481,Price Volatility: Who Determines the Value of Bitcoin and Other Cryptocurrencies?
482,Bitcoin Q&A: How Do Mnemonic Seeds Work?
483,"Running Your Own Bitcoin Node, Ethereum Node, Lightning Network Node - aantonop Q&A"
484,Bitcoin Q&A: My Response to Jamie Dimon
485,Bitcoin Q&A: What is a Private Key?
486,Bitcoin Q&A: Why is Seed Splitting a Bad Idea?
487,Immutability and Proof-of-Work - the Planetary Scale Digital Monument - classic Bitcoin talk
488,The Courage to Innovate Without Permission
489,Measuring Success: Price or Principle
490,"Can Someone Guess My Crypto Private Key? [From Sand, to Molecules, to the Observable Universe]"
491,Attacks on Bitcoin? Don't Worry; Bitcoin is Unstoppable! (But that doesn't mean we'll do nothing)
492,Is bitcoin in a bubble? Cryptocurrency taxes? Stablecoins? Jan Q&A Livestream - aantonop
493,Ethereum Q&A: ICOs and Pyramid Schemes
494,"The Crypto Airplane: understanding cryptocurrency ownership [bitcoin, ethereum]"
495,Bitcoin Q&A: Can You Trust a Hardware Wallet to Generate Your Seed?
496,Bitcoin Q&A: Geopolitics and State-Sponsored Attacks
497,"Bitcoin Q&A: Proof-of-Work (PoW), Proof-of-Stake (PoS), Delegated Proof-of-Stake (DPoS)"
498,MultiSig is NOT the best option for most people to store their bitcoin [June 2023]
499,Why Open Blockchains Matter
500,Bitcoin - Keeping Digital Communities Weird
501,"Embrace the Good, Reject the Fear"
502,Picking the Right Blockchain for the Job
503,Crypto Security: Passwords and Authentication - Livestream aantonop
504,Will Bitcoin Fail to Scale?
505,I Can't Afford One Bitcoin! What Can I Do? (SOB#457)
506,Bitcoin Q&A: Decentralised Exchanges and Counterparty Risk
507,"New Bitcoin & Cryptocurrency Exchange Regulations in the US [""Self-Hosted"" Wallets Unaffected]"
508,"Bitcoin, Lightning, and Streaming Money"
509,Decentralized Globalization: Cryptocurrencies are Superpowers for Everyone
510,Security vs. Complexity
511,Bitcoin Q&A: Will Governments Let Privacy Coins Exist?
512,Bitcoin Q&A: Is Multi-sig for the Average User?
513,Bitcoin Q&A: Atomic Swaps
514,Privacy and Scale - Everything you need to know about Bitcoin's Taproot (SOB#455)
515,"March Q&A - $7B Bitcoin Takeover, Taproot, Bitcoin Energy Consumption, NFT, LN Wallets + More [2021]"
516,The Real Truth About Bitcoin's Energy Usage
517,Andreas M. Antonopoulos testimony for Australian Senate
518,Unprecedented: Rules without Rulers [a new governance model humanistic globalization]
519,How Chris Lost His Bitcoin & How You Can Avoid Doing The Same - June 2023
520,Bitcoin Q&A: The Rules of Bitcoin (Part 1)
521,Will There Be More Than 21 Million Bitcoin?
522,"A False Narrative: White Markets, Black Markets"
523,Bitcoin Q&A: What is Segregated Witness?
524,Bitcoin and Open Blockchain Livestream Q&A with Andreas M. Antonopoulos - May 2022
525,Bitcoin Design Principles - IDEO Lab presentation by Andreas M. Antonopoulos
526,Bitcoin Q&A: Price Premiums and Arbitrage
527,Bitcoin Q&A: Wealth Distribution Statistics
528,Bitcoin Q&A: Governments vs. Proof-of-Work or Proof-of-Stake
529,"Bitcoin: Dumb Networks, Innovation and the Festival of the Commons"
530,Slush17 Panel: Farewell to Centralised Data
531,Bitcoin Q&A: Could Governments Take Over Exchanges?
532,Bitcoin Q&A: What is Mining?
533,Bitcoin Price Obsession- ReImagined
534,Bonus Livestream Session - Ethereum Basics
535,Bitcoin is Power - Power is Everything (SOB#456)
536,Do You Run a Bitcoin Full Node? [Monthly Costs & Basic Node Configuration in 2 Min]
537,Bitcoin: Where the Laws of Mathematics Prevail
538,Bitcoin Q&A: Will Bitcoin Become the World's Reserve Currency?
539,"Bitcoin Q&A: SegWit, Scaling, and Consensus"
540,Bonus Livestream Session - The Halving
541,Bitcoin Q&A: Bitcoin vs. Blockchain
542,"Ethereum Q&A: ICOs, Disruption, and Self-regulation"
543,LTB Live - Ethereum: Consensus vs Immutability
544,Bitcoin Q&A: Altcoins and Specialisation
545,Bitcoin Q&A: Hyperbitcoinization
546,Investing in DeFi? You Need to Know the 5 Categories of Risks You're Facing [2021]
547,Bitcoin Q&A: Where Can I Buy and Spend Bitcoin?
548,Why Is the IMF Afraid of Cryptozation? (Part I of II)
549,"Ethereum, ICOs, and Rocket Science"
550,"Interview: Bitcoin, Blockchain, and Beyond"
551,Should I Update the Firmware on My Hardware Wallet? Cryptocurrency Security Explained
552,Bitcoin 101 - Introduction to the Future of Money
553,Bitcoin Q&A: Why Developers are Leaving Banks
554,Bitcoin Q&A: Criminalization of Ownership?
555,Ethereum Q&A: Altcoins and the Scaling Debate
556,"Crypto Explained: Taproot Drawbacks, Bitcoin Energy Usage, Ethereum FEES!!! + more [May 2021]"
557,Buying Bitcoin Using Dollar Cost Averaging & Avoiding Dust UTXO - Self Custody Series - Feb 2024
558,"Bitcoin Q&A: SegWit, Schnorr, Taproot, and Graftroot"
559,Crypto Key Management and Hardware Wallets: Bonus Livestream Session
560,Bitcoin Q&A: Futures Markets
561,Bitcoin Q&A: What is the Appeal of Sound Money?
562,Bitcoin Q&A: The Game Theory of Staking
563,Ethereum Q&A: Initial Coin Offerings (ICOs)
564,Bitcoin Q&A: The Lightning Network
565,Bitcoin Q&A: Migrating to Post-Quantum Cryptography
566,Bitcoin Energy Consumption & Climate Change: Does Bitcoin Use Too Much Energy? [2021]
567,Bitcoin Q&A: Borderless Money
568,Cryptocurrency Explained: What is a Mnemonic phrase? [Understanding Bitcoin Ethereum Crypto Keys]
569,Ethereum Q&A: The ICO Token Explosion
570,Bitcoin Q&A: CME Bitcoin Reference Rate
571,"Bitcoin, Payment Security, and Consumer Protection"
572,"Official Cowards, Financial Scatology & Precursors to Hyperinflation (SOB 468)"
573,Cryptocurrency Explained: How to Get More Privacy on Bitcoin Transactions [Privacy is a Human Right]
574,"Gamestop, Wall Street and the Avocado Toast Revolution (SOB#452)"
575,Bonus Livestream Q&A - DeFi
576,Bitcoin Q&A: MimbleWimble and Dandelion
577,Bitcoin Q&A: The Rules of Bitcoin (part 2)
578,Bitcoin Q&A: The Internet Will Eat Your Business
579,Bonus Livestream Session - DeFi (Decentralized Finance)
580,"LTB: TheDAO, TheFork, TheFallout"
581,How and Why Governments Lie About Inflation (SOB 471)
582,"Bitcoin Q&A: CoinJoin, Privacy, and Network Bifurcation"
583,Bitcoin Q&A: Job Opportunities with Cryptocurrencies
584,Bitcoin Q&A: What Happens During a Fork?
585,Bitcoin Q&A: Bitcoin as Everyday Currency
586,Bitcoin Q&A: The Price of Losing Privacy
587,"Bitcoin Q&A: ""Blockchain, not Bitcoin"""
588,"Dogecoin, Crack up Booms and the Modern Mania"
589,Ledger Hack: Who is Ledger? What Happened? Does the Ledger data breach affect everyone?
590,"ReMastering - Bitcoin & the Elements of Trust: how do chemistry, cooking, & lego relate to bitcoin?"
591,"Paper wallets, inflation, criminals using bitcoin and...Bitcoin & Open Blockchain Livestream [2021]"
592,Breaking Up with Your Bitcoin Wallet: How Do You Move From One Cryptocurrency Wallet to Another?
593,Bitcoin Q&A: Central Bank Digital Currencies (CBDCs)
594,Bitcoin: A New Species of Money - An Evolutionary Perspective on Currency
595,Bitcoin Q&A: Is Bitcoin a Good Investment?
596,Bitcoin Q&A: Unspent Transaction Output (UTXO)
597,Bitcoin Q&A: Important Terminology Explained
598,Bitcoin Q&A: HODL strategies and their drawbacks
599,"Bitcoin Q&A: Someone Said Bitcoin is ""Dead"". What Do You Say?"
600,"GameStop, DeFi, the Queen's Gambit & More  [Bitcoin Ethereum Crypto Open Topic Q&A] - January 2021"
601,Bitcoin Elements of Trust: Unleashing Creativity With Building Blocks of Trust
602,"Learn About Bitcoin Taproot Activation & See the Numbers for Yourself [May 23, 2021]"
603,Bitcoin Q&A: Why I Earn Bitcoin Instead of Buying It
604,ReMastering The Lion & the Shark: Bitcoin vs Ethereum: Divergent Evolution in Cryptocurrency
605,Bitcoin Q&A: We All Started as Critics
606,My First Bitcoin Talk on Bitcoin Neutrality From 2013
607,Bitcoin Q&A: Intrinsic vs. Extrinsic Assets
608,Bitcoin Q&A: Schnorr Signatures and the Privacy Roadmap
609,Canadian Senate Testimony on Bitcoin
610,"Bitcoin security, NFTs, El Salvador's Volcano Bond, and more!  - December 2021 Q&A"
611,Open Blockchains for Cashless Developed Economies
612,Ethereum Q&A: How Do Smart Contracts Work?
613,Speaking Of Bitcoin - Let's Talk About Bitcoin Transaction Fees!
614,Bitcoin Q&A: From Barter to Abstract Money
615,Your Crypto Safehouse: Why Your Bitcoin Isn't Lost if Your Hardware Wallet Breaks
616,"Bitcoin Q&A: Monetary Crisis, Law, and Supply Capture"
617,Rabbit Hole -  What Should You Use if a Hardware Wallet Isn't an Option for You?
618,Bitcoin Q&A: What is the Biggest Threat?
619,"Bitcoin Q&A: Not your Keys, Not your Coins"
620,Bitcoin Q&A: Re-using Addresses
621,"Bitcoin Q&A: M-Pesa, Warren Buffet, and USD Domination"
622,Bitcoin Q&A: How is a Multisig Address Created?
623,Bitcoin Q&A: Operating a Business with Cryptocurrency
624,Ethereum Q&A: ICOs and Responsible Investment
625,"Crypto Wallets, Backup, & Recovery: What is a Crypto Wallet Derivation Path?"
626,Bitcoin Q&A: Mixing services
627,Why Cryptoization Scares the IMF (Part II)
628,Bitcoin and Open Blockchain Livestream Q&A with Andreas M. Antonopoulos - March 2022
629,"Announcing ""Mastering the Lightning Network"""
630,Ethereum Q&A: Does Ethereum Compete Against Bitcoin?
631,Bitcoin Q&A: What Happens to Transaction Fees when the Block Reward is Zero?
632,Bitcoin Q&A: Could a State-sponsored 51% Attack Work?
633,What Is the Definition of Turing Complete? #Bitcoin and #Cryptocurrency Q&A
634,Bitcoin Q&A: The Obsoletion of Legacy Systems
635,🚨 BITCOIN EXTREME ALERT!!!!! CRITICAL MOMENT UNFOLDING!!!! WAKE UP!!!!! 🚨
636,OMG!!! IT’S FINALLY HAPPENING TO BITCOIN! WARNING!!! THIS DUMP IS A DISTRACTION!🚨
637,BITCOIN BOUNCE WARNING!!! WATCH THIS BEFORE YOU BUY!!!! [this can’t be real... right?]
638,🚨 BITCOIN ALERT!!!! BLACKROCK’S SECRET MEETING!!! YOU WON’T BELIEVE WHAT’S ABOUT TO HAPPEN!!! 🚨
639,Bitcoin. I’m Speechless…
640,🔴 BITCOIN PANIC!!!! SELL-OFF CONTINUES!!! HOW BAD IS IT REALLY?!  [brutally honest]
641,🚨 ALERT!!! BUY BITCOIN NOW!!!!!! THIS IS UNHEARD OF!!!! [ I’ve never been so bullish! ]
642,URGENT!!! BITCOIN HAS DONE THIS EXACTLY BEFORE!!!! THIS CHANGES EVERYTHING!!!! [watch fast]
643,BITCOIN WILL HIT 10 MILLION DOLLARS & There’s NOTHING Anyone Can Do To Stop It!
644,"BITCOIN SIGNAL CALLED EVERY BOTTOM!! FLASHING GREEN NOW!! 14,922 BTC WHALE MOVE!!!"
645,BITCOIN: WHAT IF EVERYONE IS WRONG?!!! … AND *THIS* HAPPENS INSTEAD!!!!! 🚨 [WHAT WOULD YOU DO?]
646,🚨 BITCOIN HODLERS PREPARE!!!!! THIS WILL CHANGE EVERYTHING!!! [time running out] 🚨
647,THE BITCOIN GAME HAS CHANGED!!! FORGET EVERYTHING YOU KNOW!!! [groundbreaking data revealed]
648,BITCOIN BREAKOUT!!!? Goldman Sachs BTC Client Call LEAKED!! BULLISH INDIA NEWS 🚀
649,"HOLY SH!!T!!! BITCOIN SMASHES $30,1,2,3K!!! WARNING: LIQUIDITY SQUEEZE IMMINENT!!!!"
650,BITCOIN Winding UP for NEXT MAJOR RUN!!? Why BILLIONAIRES Are BUYING Right NOW!!
651,BITCOIN PULLBACK!!!!! WAIT…. SOMETHING MONUMENTAL IS HAPPENING RIGHT NOW!!!!
652,BITCOIN!!! I’m Sorry… But This ABSOLUTELY MUST BE SAID!!! [DON’T Ignore for 2023] 🚨
653,🚨 BITCOIN!!! ARE YOU READY FOR THIS?!! [PROOF] THINGS ARE ABOUT TO SPIRAL OUT OF CONTROL!!!!!
654,BITCOIN HISTORIC WTF?!?! THIS HAS NEVER HAPPENED BEFORE!!!!!🚨[ I feel very sorry for the bears…]
655,"BITCOIN!!!!! I’M SORRY, BUT SOMEBODY HAS TO SAY IT… [REAL TALK]"
656,ELON MUSK PUMPING BITCOIN!!!! $65k MOON SHOT!!! THE REVOLUTION HAS JUST BEGUN!!!
657,BITCOIN ALERT: IT’S ACTUALLY HAPPENING! WHALES MOVE BILLIONS!!!! [guess who?] 🚨
658,"URGENT!! BITCOIN MAJOR MOVE!!! DOLLAR COLLAPSING!!! $120,000,000 USDT MINTED!"
659,BITCOIN FINALLY Ready for MASSIVE MOVE!! Bakkt DUMP IMMINENT or FAKE OUT?! 😱
660,🚨 BITCOIN BREAKING OUT RIGHT NOW!!!!!!!! 3 MONTH DOWNTREND OVER!?!! [URGENT] 🚨
661,The BITCOIN Chart THEY DON’T Want YOU to SEE!!! DO THIS NOW: LIFE CHANGING GAINS!!!
662,🚨 BITCOIN ALERT!!!!!! INSANE MULTI-YEAR PHENOMENON!!! THEY'RE TRYING TO KILL CRYPTO!![LIVE REACTION]
663,🚨 BITCOIN ALERT!!!!!! THE SECRET IS OUT!!!!! BTC PRICE WON’T PUMP UNTIL **THIS** HAPPENS!!!
664,🚨 BITCOIN: HERE IT COMES!!! ACT FAST!!! MAJOR GLOBAL SHIFT?!! WARNING SIGNS...
665,BITCOIN WTF?!!!?! THIS JUST GOT *SUPER* AWKWARD… WHAT’S REALLY GOING ON?!!🚨
666,🚨 BITCOIN: THIS IS VERY CONCERNING!!!!!! A SCARY COINCIDENCE!!?!! [brutally honest truth…]
667,🚨 BITCOIN EMERGENCY!!!!!!!!!!!!!!! MASSIVE DELEVERAGING NOW!!!!!! [this is NOT okay] 🚨
668,"BITCOIN FLASHES SUPER BUY SIGNAL!!! 🚀 $10,450 NEXT!? BTC OVER $20k THIS YEAR!!!"
669,BITCOIN PARABOLIC NOW!!! NO MORE DIPS!!? [PROOF] BTC IS JUST GETTING STARTED!!! 🚀
670,BITCOIN WINDING UP!! HUGE MOVE INCOMING!!? $BTC ETP LISTED on STOCK EXCHANGE!!
671,BITCOIN: Was THAT the BIG “Bakkt Dump”? Altcoin Rally OVER?! $BTC ETF Cancelled!?
672,BITCOIN & ETHEREUM SET TO EXPLODE!!! HUGE USA NEWS!! WARNING: BTC SHORTAGE POSSIBLE!!!
673,Bitcoin……… it’s over?
674,BITCOIN Bounces Back!! $30k BTC MINIMUM 2020? BREAKING: Michael Bloomberg Crypto Clarity
675,BITCOIN: BULLISH NEWS!!! This Could SURGE BTC to $20k!!! There’s Just ONE BIG Concern…
676,🚨 BITCOIN: MAJOR SHIFT RIGHT NOW!!!!!!!! LIKE NOTHING SEEN BEFORE!!!!!!! [72 hours and counting…]
677,🚨 Bitcoin: It’s About to Get VERY SERIOUS!! What They’re NOT Telling You [watch before Monday]
678,Bitcoin BREAKDOWN?! Altcoins PUMPING!? 2017 'COINCIDENCE' Hints to NEXT MOVE!!
679,🚨BITCOIN ALERT!!!!!! THIS IS ABSOLUTELY HISTORIC!!!!! COINCIDENCE?! [WARNING]🚨
680,WOW!! ‘BITCOIN HALVING' Trends SURGE!! 🚀 Stablecoin BAN Proposed!! DeFi in TROUBLE?!
681,🚨 BITCOIN WARNING!!!!!! THIS WILL SEND SHOCKWAVES!!!!! [48 HOURS MAX] HURRY!!!!! 🚨
682,BIG News for BITCOIN!! $60 MILLION USDT MINTED... What For?! NEW US Crypto Tax Bill
683,Is FED Actually About to DESTROY Bitcoin?! The Game Has CHANGED [it won’t be easy]
684,ALERT!!!!!!!! BITCOIN BREAKOUT NOW!!!!!?!! BUT… THIS IS VERY SCARY!!!! [watch fast]🚨
685,🚨 BITCOIN!!! ARE YOU PREPARED FOR THIS?!!! BE HONEST!!! #bitcoin #btc #bitcoinnews #crypto #shorts
686,Is Crypto DEAD?!? What Went Wrong & Why Does Good News NOT Affect Price?!?
687,Was THAT the LAST Chance to Buy CHEAP Bitcoin?! Will $BTC Dump AGAIN?! [BTC Fundamentals]
688,🚨 THEY WILL SEIZE YOUR MONEY IN 2023!!! #GeraldCelente via Stansberry Research #bitcoin #gold #cbdc
689,🚨 WOLF IN SHEEP’S CLOTHING?!!! What are your thoughts about the new #Ledger Recover?  #bitcoin #btc
690,$XMR Hard Fork: 4 MORE Moneros?!? $NEO Tour | 🤑 BlocNATION Airdrop | $ONT Supply? | $PPT x $KMD
691,All Cryptocurrencies Are NOT Created Equal | A Guide To Digital Assets | $BTC $ETH $BNB $USDT $SDT
692,The Truth on Hamster Kombat: Revolution or Scam?
693,"""The guards in prison asked me what coin to buy"" | CZ Interview"
694,"Steve Wozniak: ""What an Incredible Thing Bitcoin is"""
695,Arthur Hayes Reveals the 'Perfect Time' to Buy Crypto
696,Cryptocurrency vs the World’s Wealth
697,Learn to speak crypto with Cointelegraph
698,Top 10 Richest People in Crypto
699,ETH to $10K this cycle: Will Ethereum outperform Bitcoin? | Price analysis with Scott Melker
700,"What is Cryptocurrency? Virtual Money, Bitcoin and Altcoins | The main features and types"
701,Is the Crypto Bull Market Over? Kevin O'Leary Breaks It Down
702,Macro Factors May Drive Bitcoin Up 100x in Next 5 Years | Interview with Raoul Pal
703,Asking Dubai Crypto Tycoons How They Got Rich
704,Macro factors can propel Bitcoin to $1 trillion market cap  | Strategic investor explains
705,History of Cryptography | A Cointelegraph Documentary
706,WHY DID THE CRYPTOCURRENCY MARKET CRASH?
707,"The Dow Crashes, Bitcoin Crashes | Hodler's Digest"
708,Why Bitcoin Can Still Hit $100K in 2021 | The Moon & Tone Vays
709,How a Pakistani celebrity and crypto billionaire challenged his government | Crypto Stories Ep. 7
710,How Crypto YouTubers Become Rich: All Secrets Revealed!
711,Bitcoin Bull Run 2024: What Makes This Time Different
712,The Most Dangerous Crypto Scam: Victims Speak Out
713,When Will Altcoin Season Start? Key Signs to Watch
714,Blockchain Games: Fad or Future?
715,Ethereum Is Dying... Or Is It a Hidden Gem for 2025?
716,How Thailand went from a tourist paradise to a crypto tech-giant | Cointelegraph documentary
717,"CZ: Bitcoin Price, AI's Role & What Founders Should Actually Build | CZ at Token2049"
718,Is Sui the new SOL? Why you should NOT ignore it
719,Bitcoin to $20K by Year End?  | Alessio Rastani Vs. Charlie Burton
720,How Charlie Shrem Became a Bitcoin Millionaire | Crypto Stories
721,HISTORY OF MONEY | What is Bitcoin? Where did cryptocurrencies come from?
722,What is a cryptocurrency? Explained with animations | Cryptopedia 101
723,How to keep your crypto safe in 2023 | Analyst explains
724,Altcoin of the Week | Ripple XRP
725,The 4-Year Bitcoin Cycle Is Broken. Here’s What Comes Next
726,Adam Back on Trump Tariffs and Why This Is a Good Time to Buy Bitcoin
727,Cardano founder Charles Hoskinson explains Ethereum’s and Bitcoin’s flaws
728,Bybit Hack EXPOSED: Inside North Korea’s Cybercrime Empire
729,Bobby Lee's Crypto Portfolio | Cointelegraph
730,Top 5 Places You Can Spend Your Bitcoin
731,Crypto in 2025: Which Coins Will Dominate? (Top Predictions!)
732,Crypto Lending: The Ultimate Killer App? | Cointelegraph Report
733,How Low Will Bitcoin Fall? | Eric Krown vs. Joe DiPasquale
734,How does MicroStrategy buy Bitcoin - Explained in under 3 minutes
735,Bitcoin to $10 million: the rise of the Bitcoin aristocracy? | Interview with Dan Held
736,Bitcoin conference and a bad trip to North Korea | Crypto Stories Ep. 10
737,Why Alex Tapscott quit his high-paying job to write a book about Bitcoin | Crypto Stories Ep. 14
738,Why Gavin Wood decided to code Ethereum | Crypto Stories Ep. 5
739,Cointelegraph Crypto Traders Live | World’s Largest Live Crypto Trading Event
740,How to set up a cold wallet in just 6 minutes | by Arculus
741,$300K Bitcoin THIS Year? Carl Moon Says It’s Coming
742,"$8K Is Bitcoin's Next Target, But Will a Plummet to $3K Follow? | Charlie Burton & Clement Ip"
743,IT Analyst Jason Bloomberg: What I’m Really Saying Is ‘Shut Down Permissionless Blockchains’
744,IBM — Blockchain Revolution From the $140 Billion Company
745,"FTT, Bitcoin crash EXPLAINED: Binance acquires FTX?"
746,Week of Altcoin: DOGECOIN |Such Crypto! WOW | ft. Shilling
747,Bitcoin Market Crash: Why It May Be Only the Beginning
748,Is Bitcoin a Safe Haven for Your Money? | Inventor of Yield Curve Signal Explains
749,Time to Start Buying Bitcoin Again? | Crypto Markets
750,"Bitcoin Miami 2021: Inside the 50,000+ attendee event"
751,"Crypto in the USA, Part I: Introduction | Cointelegraph Documentary"
752,How Portuguese street artists are turning graffiti into NFTs | Cointelegraph Reports
753,Bitcoin on the battlefield: How Ukraine is utilizing crypto | Crypto Stories Ep. 9
754,What is a DAO? All you need to know about decentralized autonomous organizations | Cryptopedia
755,What is Binance CEO most excited about in 2022? | Interview with CZ
756,Bitcoin in 2021: Unstoppable force or dangerous bubble? | Cointelegraph Crypto Duel
757,Futurist Explains 5 Keys to the Next Crypto Boom
758,BREAKING: Spot Bitcoin ETF Receives Official Approval From The SEC
759,Bitcoin Price Explained
760,"Crypto Rally, Elon Musk Bullish on Bitcoin, Buterin’s Cryptocurrency Fortune | Hodler’s Digest"
761,The pound and euro crisis: What does it mean for Bitcoin? | Alessio Rastani
762,Mantra CEO: Trillions in Real World Assets Coming to Crypto!
763,Fastex Showcases the Future of Web3 at Paris Blockchain Week 2025
764,Pierre Rochard Vs. Jorge Stolfi: Is Bitcoin a Ponzi? | Cointelegraph Crypto Duel
765,Bitcoin Cash Is Something Worth Stealing — Roger Ver on $45-Million Hack
766,Which crypto assets will dominate 2022? | Bloomberg Analyst’s crypto outlook
767,What is blockchain? Explained with animations | Cryptopedia 101
768,Altcoin Prices SURGE and DROP in 24 hours | Pump and Dump Whales to Blame?
