,title,video_id
0,Coinex: Complete Guide To Leveraged Crypto Trading In 2025,lHwF28kjEbk
1,Bitcoin’s All-Time High Is Just Step 1! [Step 2 Will Break Crypto!],YW_8dCY4q0U
2,What This Hyperliquid Whale Just Said About Bitcoin Will SHOCK You (Live),3NfP3u8R_C0
3,Ethereum Just Got Its Own MicroStrategy! [Huge Crypto News!],ibgsVhXjfRA
4,MAJOR Altcoin Buying Opportunity! [Act NOW Before Bitcoin Explodes!],qeH6nvCrHyw
5,Bitcoin All-Time High ✅ Phase 2 Is Next! [ALTCOIN PUMP],mjdsZW2nzS0
6,URGENT: Ignore The Noise! | This Is What’s NEXT For Crypto!,AJNItx_p8wc
7,BULLISH ALTCOIN SIGNAL FLASHING! 🚨 It’s Only the Beginning!,WKf-fVb_4Y4
8,The Perfect Crypto Exit Plan! [Don't Miss This AGAIN!],nzaqGQ1inuQ
9,"If I Only Had $1,000, I’d Bet On This Crypto Trading Strategy! [PROVEN]",QUYI_gP1iVg
10,Trump Bullish News?! You Know What Happens Next in Crypto...,MwmbDBwLRZY
11,I Taught A Newbie Barista How To Trade Crypto [Here’s What Happened],4LpQRgSDERc
12,My Crypto Trading-Bot Is OUTPERFORMING Your Favorite Trader! [COPY IT],FePhsSO5jGk
13,This Crypto Project Is Making AAVE & Uniswap Obsolete!,Xg-8K2yPPx4
14,The Crypto Pump Is Close! [TOP ALTCOIN PICKS NOW],e_ipK-bKSU8
15,You’ve NEVER Experienced A Crypto Conference Like This! (360 Video 4K),1DXngOXkgQE
16,5 BTC to turn on The Bitcoin Faucet 🚰,pnptrd3oZo8
17,Just Trying To Retire My Entire Bloodline 🤣,6lv_FsYozII
18,Are We In A Real Bull Run? 📈 📉,Zu_clcDkohk
19,Bitcoins Next Move? 📈 📉 (May 2025),-fhEad1MFac
20,The SECRET To Becoming A Bitcoin Millionaire No One Tells You!,ZFtY7IIevJM
21,DOUBLING Our Money With GAMESTOP GME! (THEY SECRETLY BOUGHT BITCOIN AND WILL ANNOUNCE IT NEXT WEEK!),B6bzHQ9uVwA
22,NEW BITCOIN ALL-TIME HIGH! MOONSHOT IMMINENT!,ol0or3QnpVk
23,"BITCOIN DROPPED $5,000! Trump Tariff Threats CRASH Bitcoin! New Correction?",THEE6XyCCks
24,How to Turn ₹1 Lakh into ₹1 Crore in 2025 | Winning Stock Strategy | Deepak Wadhwa | #trading #money,mpJ8ySihQMY
25,💰Top 5 Crypto For High Returns🔥#crypto #cryptocurrency #trading,V4lScsjToxA
26,Don't Miss These 3 Investment Ideas💰,TbBKGxgMPlA
27,"Stop Overthinking, Just Focus on These Simple Stock Strategies! 📊💡| Deepak Wadhwa @stockswithrochit",HqCBQoQsFY4
28,How to Turn ₹500 Into ₹1.5 Crore | Power of Compounding Explained! | Deepak Wadhwa | #trading #money,bLB4Boq4wf4
29,I launch my trading course! #stockmarket #tradingcommunity,QMv4yEBcmNM
30,Sectors to invest in India #sector #stockmarket,18mz7DT5JZE
31,Bank Nifty Trading Strategy | First 30-Min Candle Setup | Deepak Wadhwa | #stocks #money #nifty,Y1GSKGcSKc8
32,How to protect your crypto?🤔#crypto #cryptocurrency #bitcoin,iuP3FwRAl8E
33,You will loose your all money if you're trading like this!😫😨 #stockmarket #trading #sorts,K2v5wBNjHAI
34,Truth About Pump & Dump Crypto Schemes with @stockswithrochit  | Deepak Wadhwa | #pump #dump #money,a3i5nw4jGeE
35,Why I'm NOT Buying Crypto in 2025 | Wait for THIS Signal! | Deepak Wadhwa & @accurate_arun  #crypto,BcoXkr-7D2g
36,Don't miss these meme coins for high returns💰#crypto #cryptocurrency #memecoin,WwPO0McG7Ao
37,💡 Why You MUST Activate the MWP Clause on Your Life Insurance! 🔥💰| Deepak Wadhwa | #insurance,NKDZPnxoWKE
38,Build Crores With Just 20K SIP💰🔥#sip #returns,mdvh7g2p-5Y
39,4 steps that I personally follow while investing! 📚 #stockmarket #trading,BU4iF6P0ivg
40,How to Turn ₹5000 into Crores: Best Coins to Invest in 2025! 🚀💰| Deepak Wadhwa | #trading #crypto,OXigC-kRtLU
41,Crypto Trading Made Easy for Future Financial Growth || @iamyashgupta #podcast #bitcoin #deeptalks,vrj2kTIWvcA
42,I did this mistake & lost my all money! 😨😫#stockmarket #trading #mistakes,1bw2K8SHUCc
43,What changes can we expect after Elections? 🗳,PSegPq_ABzM
44,Aniruddhacharya Ji: Viral बाबा ka Stock Market Connection @Aniruddhacharyaji #podcast,EGrrcXCXgmY
45,Don't miss huge profits of crypto🔥#crypto #cryptocurrency,2NDqUwNQdwo
46,@AbhishekKar  Exposed | Secrets of Wealth & The Illuminati Unveiled! | #deeptalks #podcast #srk,vEVh9D4375E
47,Complete Cryptocurrency Research Guide for Beginners | Deepak Wadhwa | #crypto #stocks #deepakwadhwa,ZfSl_ohNuXk
48,Which ETF Will Give the Best Returns? #deeptalks #stockmarket,9VNFwFzLyKY
49,The Journey from Job to a Professional Trader ft. Arjun Tandon | The Deep Talks - Ep. 2,QLVgRkpOTtY
50,Don't Miss These 4 Monopoly Stocks💰#stockmarket #stocks,wSW8uvo9Mws
51,Do you invest in penny stocks? #stockmarket #trading,ekyzWETYy0U
52,Top 3 Multibagger Stocks | Chart Formation | Huge Profits in Stocks | Deepak Wadhwa | #trading,Bq1cNGU9PR4
53,Crypto vs Stocks: 494M% Returns in Days! 🚀 | Top Crypto Coins for 2025 | Deepak Wadhwa | #stocks,1WdoZgkle28
54,Pankaj Bhardwaj Reveals Secret Trading Strategies | Podcast 2.0 #stockmarket #stockmarketstrategies,TgvyKez42Z8
55,Market Master: Non-Lagging Indicator Insights || @ghosttradeindia,METmPx-yQQk
56,"10,000 to lakhs option buying road map from expert | ft. Roshan | #deeptalks #stockmarket",Qs5f4qGGVt0
57,Market Behaviour vs Knowledge: Sahil Rohmehtra's Trading Insights | The Deep Talks #traderpodcast,j-cb0i97PZg
58,Top 4 Cryptos You Can’t Ignore in 2025!🚀#cryptocurrency #crypto,E8jxNfKfIRw
59,Water Stocks: Next Big Thing! 💧🚀#waterinfrastructure #stockmarket,3ryJcD9YtK4
60,Most Important Lessons for Successful Trading #stockmarket #trading,lG1Im0wvlTE
61,Easiest Way to Find Multibagger Stocks with @stockswithrochit || #deeptalks #podcast,SYMurZJfudk
62,Easiest Way to Read Stock Charts in 5 Minutes! 📊🔥| Deepak Wadhwa | #trading #stockmarket #charts,Gl45q_wxM5M
63,Crypto Reality Check | Can Penny Cryptos Ever Hit $1? | Deepak Wadhwa | #trading #crypto #money,bQqm2gMoNFM
64,🚀 Meme Coins vs. Top 10 Crypto – Where Should You Invest? 💰📉 | Deepak Wadhwa | #cryptotips #meme,zBzA54E9XTU
65,"How to use astrology in stock market, What is laal kitab ? Ft. Dr Yogesh Sharma @HappyLifeAstro",DHXuyXSPh-E
66,Swing Trading Strategy || Deepak Wadhwa Podcast,a6UKgbCzgB8
67,Discover the Best Websites to Find Multibagger Stocks 📈💰#multibaggerstocks  @stockswithrochit,yYPk8OQTeFw
68,Where Will Bitcoin in 4 Years? #bitcoin #cryptocurrency,QFrlkc4Ehyg
69,Top Futuristic Sector for High Returns💰#stockmarket #stocks,pRrk_nx2aM8
70,Master the power of option buying for huge profits || @NitinMurarkaNifty,S2pE-tAI46Y
71,💰5 Companies With Order Book Bigger Than Market Cap🔥#orderbook #marketcap #stockmarket,AZnyQEUlD74
72,🚨 People are losing money in Bank Nifty. Here's how to avoid those losses and make profits! #shorts,P0x9X25fMIw
73,Crypto Market: Will the Bull Run Last? | Predictions & Risks Explained | Deepak Wadhwa | #crypto,-k3IqzgispI
74,Best time to trade! #stocks #trading,9gNKxU-0brs
75,Trump’s Tariff Move Explained 🇺🇸📈 | Why US Prices May Rise! | Deepak Wadhwa | #money #trump #tariffs,wgTXWK3_TZU
76,Options Trading Demystified in 60 Seconds || @SuperTraderLakshya,Tp2ikcUXdE4
77,Stock Market Ka Direction Jaanne Ka Sampoorn Gyaan | #deeptalks  |FT. @RuchirGupta1,WHy1eVCzIZo
78,Thinking of Shifting to Dubai? Here’s What It’ll Cost You,hviJHmqsGHk
79,"Abhishek Kar reveals stock tips, billionaire strategies and secret to luxury life | #deeptalks",zvCk4seluFc
80,Bitcoin & Cryptocurrencies: Clear all your doubts Now | Ft Jeet Shah | #deeptalks #crypto,KjnQjaCDwJs
81,Option Selling Secrets: How to Win Consistently!,Ld0lM9WqgdM
82,Make money with option seller #optiontrading,HxMflIC4E6s
83,Key to regular income from stock market | #deeptalks #stockmarket,3gJEtvzL0DM
84,Which Option Call Does Roshan Buy? #deeptalks #stockmarket,DlkYbKfX8KE
85,Nifty to Hit All-Time High Before August! 🚀 | Deepak Wadhwa with Rochit Singh | #stocks #nifty,TTGxZi3-gKk
86,How To Earn 1 Crore With Just ₹10000 Per Month?💰#mutualfunds  #money,BY4Ydgtmht0
87,Right time to exit from trading #stockmarket #trading,zpYsf80h3Ng
88,StopLoss or Stop Your Loss - Smart Stoploss By Deepak Wadhwa,uZdrm3bkcxs
89,Best Free Websites for Traders | Free Trading Tools for Beginners 💰📊 | DeepakWadhwa | #trading,i6ladmkbcYk
90,Free Cypto Trading Course  | #trading #crypto #bitcoin #deepakwadhwa #cryptotrading #trading,dg27u2KKs7U
91,How To Make Big And Easy Money in Stock Market by Investing & Trading | @Mrinmoyaieducator,e28EB_pULG8
92,Delta Exchange is for  traders or for investors and its regulations🤔.@deltaexchange #crypto,BGGDseO_xoQ
93,Share Market में सिर्फ़ Profit होगा || Ft. Jasneet Singh #trading #podcast,NUfmliuGrxg
94,🤔How to find multibagger stocks?🤯#stockmarket #multibaggerstocks,daN0_s6eMo0
95,Top option strategies – Maximize Profits & Minimize Risks! | Deepak Wadhwa |,DtmOFuxsN90
96,Don't Get Involved In These Ponzi Scheme🔥#money #scheme,SMLx1m1eElA
97,🍽️ My Favorite Food Spots! Best Street & Restaurant Food Guide 🤤| Deepak Wadhwa | #food #foody,Isn-Ilfxka4
98,Where to invest in India ? #stockmarket #trading,vT_ZdewPw0M
99,How he became a profitable options trader! #deeptalks #stockmarket,JWYs6Vv-isk
100,Sectors to benefit from Modi Govt!! 📈💯,Hb_kCwrFD3M
101,Game Changing Indicators for Option Traders || PROFIT making strategy with PUNCH by Deepak Wadhwa,l1xN4SUKkSI
102,Perfect option strategies roadmap by pro trader Reyansh #deeptalks #stockmarket,qCmyPokCltM
103,What’s your Doge coin prediction?👇#dogecoin #cryptocrypto,EiAYwe8lbQM
104,**Money Making Remedy** @AstroWala,4oy249OcYHw
105,Nifty & Bank Nifty Options Trading: PCR Strategy & Live Market Analysis with Nitin Murarka,mq8-IIfsxGM
106,Best Intraday Indicator for Bank NIFTY 🔥 | 5-Min Chart + 21 EMA Strategy Explained! | Deepak Wadhwa,An379Rwvxpg
107,Passive income from Crypto trading for beginners | Ft. Pankaj Balani from Delta Exchange #crypto,I__O0PR-dkI
108,Mistakes every trader do! #stockmarket #trading #investing,0Sy5klFotHw
109,Option Trading: Tips from Super Trader Lakshya || @SuperTraderLakshya,hPVFCcjlS8Q
110,Don't Miss The Opportunity Of Stock Market🔥#stockmarket #trading,6XPQpunCILg
111,Nifty EV and New Age Automotive Index! 🚗🔥 #nse #nifty,E3WNMZF2Wco
112,OSHO's Life | His complete journey by Anand Arun | osho hindi speech | osho biography in hindi,1lyEO1-HGNc
113,Bank Nifty Downfall: @Malkansview1 #shorts,O9zmJl07xnk
114,Crypto Investment Truth: What They Won't Tell You About Bitcoin & Solana | Deepak Wadhwa | #shorts,YtfvWTUWw6Y
115,Beware of this trading scam! 📈🎯#stockmarket #trading #stocks,kZd5U6akhts
116,Decide market future with this method! #stockmarket #trading,qENN5bCjv6k
117,My Trading Secret! | Apps that I use for Trading!,pJlklIZuus4
118,Shikha Pruthi’s Inspirational Trading Journey & Secret Strategies! #deeptalks #stockmarket,Frh8LkoX1ic
119,What is bhav copy? #trading #stockmarket,e6Wj22x0lqs
120,How Much Term Insurance Should You Take? | Best Advice for Indians | Deepak Wadhwa | #insurance,ZXuKernaNP8
121,Ghost Trader- A Money Printing Machine #deeptalks,lvSkAjPQ16U
122,How to invest in shares at Pre IPO stage,9cvG8qAJyWg
123,CRYPTOS MADE EASY WITH DEEPAK WADHWA | 19th  January 2025 (NEW REFERAL LINK),70lrX04fY04
124,How to invest in shares at Pre IPO stage,9cvG8qAJyWg
125,CRYPTOS MADE EASY WITH DEEPAK WADHWA | 19th  January 2025 (NEW REFERAL LINK),70lrX04fY04
126,Market Crashes Are Actually GOOD for Your SIP! | Investor's Secret Weapon | Deepak Wadhwa | #stocks,HnRNblCTL5Q
127,Invest in Top Stocks with Just ₹200! 🚀💰| Deepak Wadhwa | #stockmarket #investing #money #stocks,xXm9Sp4-cZk
128,Trade Timing Revealed-How Long Roshan Stays in a Trade! #stockmarket,v7RCDgIEnB4
129,100 crore ki journey आसान शब्दों में || Ft. Akhil Gupta,teK46FvmVe8
130,CRYPTOS MADE EASY WITH DEEPAK WADHWA | 26th January 2025 (NEW REFERAL LINK),EFQUKRckiL4
131,Aakhir ye Operator hai kon? 🧐,sVXuhboqu6Q
132,Reasons for Divorce in Wealthy Families | @AbhishekKar,OP5rYFa7KC4
133,"Dark Reality Of Trading Tips Or Experts, That You Should Know | #joshtalks #tradingexperts #stocks",-oznHNxj6CM
134,Sujal’s Secret Strategy for Consistent Profits! #deeptalks,6OkSTlg7CTw
135,Stock Market Trading FREE Masterclass on Candlestick Pattern and Price Action || @chartanalysis123,_17GXRTlKYo
136,He Turned Losses Into Profits – Roshan’s Option Trading Secrets! #deeptalks #optionstrading,6jdHjTPGXn4
137,Remarkable Growth of a Boy From Small Town to Big Luxury Cars at age of 22 || @shashwatamrev,KVqNSGV9PHM
138,Trading सीखो और कमाओ! Trading start कर रहे हो तो yeh एक pro tip सुन लो | #trading #tradingcharts,hnYqrxFaAqI
139,One Strategy can change your entire trading game! #stockmarket #stockmarketstrategies,-memEy3-gjE
140,💰Earn Money With Sector Rotation🔥#stockmarket #profit,PHWOfx4r6TU
141,🚀 Crypto Bull Run? How Long Will It Last? | Future of Crypto in 2024! 🔥| Deepak Wadhwa | #crypto,1Fhrz5-PSU8
142,💰Learning Is Better Than Loss🔥#stockmarket #loss #learning,ycOp5mogRG8
143,300K followers announcement!! 💯🔥,V8tOU2UGfYY
144,Trader ko loss se kya seekhna chahiye? 🤔,tZM9hFZtJL0
145,Don't Get Fooled By Others🤯#telegram #scammer,ktdmhauqEmY
146,🤫 Stocks mein paise banane ka secret jano expert se!,JemRyogpMpg
147,CRYPTOS MADE EASY WITH DEEPAK WADHWA | 2nd February 2025 (NEW REFERAL LINK),77Eqh5A1QuQ
148,AI-Game changer in stocks and education | Ft. Santosh Kushwaha #Volkai,COH9Hm_K-rI
149,CRYPTOS MADE EASY WITH DEEPAK WADHWA | 28th January 2025 (NEW REFERAL LINK),QguH4mZfKi4
150,Don't Miss Crypto Biggest Bull Run 2025 || Ft. Yash Gupta,3PGX1T64wFA
151,Reality of mutual fund #mutualfunds #investment,ceOx05NtOd4
152,"How to Build ₹100 Crore Wealth with SIP | Start Early, Retire Rich",uGt7ray9_mY
153,Master Futures Trading: Watch Live $1600 in Under 1 Hour! || ‪@SniperAutoTraders,pJSIOK1gHJ0
154,Want to learn Crypto Trading? | Deepak Wadhwa | #stockmarket #crypto #trading #money #cryptotrading,E6KttGikUyE
155,"Sanjay Kathuria: Stock Market, Mutual Funds & Wealth Growth Explained | Podcast 2.0 | #stockmarket",7uvpgmolB5Y
156,"Nifty & Bank Nifty Fall, But These 3 Stocks Are Rising! | Deepak Wadhwa | #trading #money #stocks",ar2qNLJnfsI
157,Stop Overthinking Before It Hurts You || @ANURAGRISHI,sInjEufflC0
158,Kya sach me market crash ho gaya? 😲 #stockmarket #trading,FjQHZKbMEKI
159,Budget 2025: No Tax Up to ₹12 Lakh! | Huge Opportunity for Investors 🚀 | Deepak Wadhwa | #budget,iI8qA_83jNQ
160,Market Expert से सीखे Crore का Business बनाना || Ft. Basesh Gala,rzJAcUdsXZ4
161,"Comment ""Link"" for more details🔥#stockmarket #trading",cwytwHd_J8U
162,"Crypto trade with zero commission brokerage || Live crypto market analysis || 20th Nov, 2024",skPA3Z4cQEQ
163,CRYPTOS MADE EASY WITH DEEPAK WADHWA | 25th January 2025 (NEW REFERAL LINK),blr-mwU-ESg
164,Who is a Successful Trader?🤔#trader #stockmarket,5sbf8YsVj0I
165,Manifest anything : attract money in your life || Deepak Wadhwa Podcast,D9k3GUGOT8A
166,CRYPTOS MADE EASY WITH DEEPAK WADHWA | 21st January 2025 (NEW REFERAL LINK),lYTh7fgVs5M
167,Trade With World's best Non-lagging indicator || @ghosttradeindia || Part 2,6tZ1_FhSBso
168,5 Minutes a Day to BOOST Your Confidence and Stay FOCUSED || @UjjwalPatni || Deepak Wadhwa,EoE8Ojy46TA
169,93% Traders Are Losing Money! Here’s Why & How to Fix It! 💰🚨,FF0opSLJYGU
170,Discussion with CNBC Managing Editor #cnbc #anujsinghal,kDyG9VpZVys
171,Live crypto market analysis | 06th January 2025,vuvTE1ZRcj0
172,CRYPTOS MADE EASY WITH DEEPAK WADHWA | 18th  January 2025 (NEW REFERAL LINK),jofDnUvyh8E
173,Live crypto market analysis | 21st December 2024,urN8pisxSDg
174,Dr. Aniruddhacharya Ji on Deeptalks – A Sneak Peek into Spirituality!,LvIaVDQUJWI
175,💰Watch This Before Investing In Mutual Funds🔥#stockmarket #mutualfunds,aXS2DoF4amo
176,How To Save Capital In Trading ? #stockmarket #shorts,VKD2ZK_OCQk
177,CRYPTOS MADE EASY WITH DEEPAK WADHWA | 16th  January 2025 (NEW REFERAL LINK),Utl2zsIgmMI
178,India's got latent controversy | Ranveer Allahbadia | Samay raina fulll video @SamayRainaOfficial,a-VgtuGQJWM
179,"Crypto trade with zero commission brokerage || Live crypto market analysis || 16th Nov, 2024",fdoAViUMRQY
180,CRYPTOS MADE EASY WITH DEEPAK WADHWA | 22nd January 2025 (NEW REFERAL LINK),X9USp8aSklw
181,Live crypto market analysis | 13th  January 2025 (HAPPY LOHRI),zABGrkozrOA
182,CRYPTO TRADING WITH  Deepak Wadhwa | 9th March 2025 (NEW REFERAL LINK),RSmxtaLtuns
183,SIP vs Stock Market | Deepak Wadhwa | #sip #stockmarket #stocks #money #deepakwadhwa #trading #vs,Fp3wfEkYLIM
184,Algo Trading Secrets & Insights Unveiled – Teaser Out Now #trading #newpodcast,n169N4gWMyA
185,"Smarter Trading, Faster Execution! 🚀📈 | Deepak Wadhwa |",Yl6xV8Hzbkc
186,Market Myths Exposed: RSI 80+ Strategy for Real Profit! 📈| Deepak Wadhwa | #market #trading #money,fRXGTIhjg6k
187,Adani's Mission to Transform India's Youth | Deepak Wadhwa | #gautamadani #youth #sevaoverself,s6eKTzHtYKw
188,Live crypto market analysis | 08th January 2025,04Mjjt0RyjA
189,CRYPTOS MADE EASY WITH DEEPAK WADHWA | 30th January 2025 (NEW REFERAL LINK),Bip5oyGhpT4
190,How to Inves as a Beginner in 2025! #deeptalks #stockmarket,zG8Py6WkIb4
191,How to make money in stock market | #deeptalks #abhishekkar,RuWnZ2ha0WA
192,CRYPTO TRADING WITH  Deepak Wadhwa | 27th  February 2025 (NEW REFERAL LINK),OfsqT9MIljQ
193,Manifesting Stock Market Success with Gratitude || @ReadersBooksClub || Deepak wadhwa Podcast,qhWEasiOOvg
194,🤯Don't Invest in Mutual Fund Blindly🔥#mutualfunds #sip,Z5OOCmYlCCc
195,"Crypto trade with zero commission brokerage || Live crypto market analysis || 2nd Jan, 2025",kJ7AHNRBDZg
196,Crypto & Stock Market Secrets | Deepak Wadhwa with @financewitharun2236 | #trading #crypto #charts,4KvNCnAU3Fc
197,CRYPTO TRADING WITH  Deepak Wadhwa | 10th March 2025 (NEW REFERAL LINK),sHZ1MDS0zV0
198,"Crypto trade with zero commission brokerage || Live crypto market analysis || 18th Nov, 2024",VdC4-o6EzkI
199,CRYPTOS Lets make it big with Deepak Wadhwa | 7th  February 2025 (NEW REFERAL LINK),ri-yoEVvaa8
200,What’s the secret behind this effective nifty price action method? #stockmarket #nifty,mfE-LISLpCM
201,Is Ather a Good Option?,vDrd5jJjRXA
202,Live crypto market analysis | 09th January 2025,K_J54qQ7hm0
203,Algo Trading Secrets Revealed : with Dharmik Thakker || Deepak Wadhwa Podcast,xhJPPVNczv8
204,CRYPTOS Lets make it big with Deepak Wadhwa | 9th  February 2025 (NEW REFERAL LINK),-i5BO_EjAAU
205,क्यों नहीं करनी चाहिए लक्ष्मी जी की आरती? @AstroWala,vAhQqb7OUkw
206,From Beginner to Pro | Options Trading Strategies | Ft Reyansh #optionstrading #stockmarket,xLDJrohMxFE
207,1 Million Follower || @stockswithrochit #followersinstagram #deeptalks #podcast #stockmarket,9GZ8cnMuqOA
208,Coming Soon: Abhishek Kar's Exposed Podcast – Secrets of Wealth & The Illuminati Unveiled!,zcFgsrPvf_o
209,Some tips you must know as a investor!💡#stockmarket #trading #stockinvesting,if-lxxXLaWs
210,Intraday Equity | TheDeepTalks | @RuchirGupta1,uS313nZXIx4
211,Beware of Fake Accounts!! ⚠️🚨,LvqK7iqzPiU
212,"Live crypto market analysis |  14th Nov, 2024",3Q7gcxICkkU
213,How Sebi Regulates Algo?🤔#marketstability  #tradingrules,5oRfWuix8_g
214,Is Trading a Career for You? | Career Advice | Deepak Wadhwa | #trading #career #investing #money,C7z8ajuxzII
215,पैसे की आवक with @AstroWala,-DjE6Qn5KTM
216,📕💯 What are Highlights of Budget 2024-25?🔥#budget #trading,lqD3dpqgjLU
217,CRYPTOS MADE EASY WITH DEEPAK WADHWA | 24th January 2025 (NEW REFERAL LINK),pfxwlKtn0hc
218,What Billionaires Know That You Don’t | @AbhishekKar #deeptalks,MGDiI6JoNLM
219,💰Don't miss these stocks for high returns🔥#stockmarket #stocks,3eGps8Uqqcw
220,Sectors to Watch which can give High Returns🔥#stockmarket #trading,nBYLcI1ZyNc
221,CRYPTOS Lets make it big with Deepak Wadhwa | 15th  February 2025 (NEW REFERAL LINK),mdKD9cODn54
222,Crypto Trading for Beginners! | Deepak Wadhwa | CoinDCX | #trading #crypto,y3bHbBfsmYk
223,Where Should You Invest Now | #deeptalks #sip,l0aoE4mA0w4
224,XRP AND CARDANO NEWS THAT WILL SHOCK YOU! BITCOINS NEXT BIG MOVE,-QhPszURmoM
225,Best Crypto Tracking App Ever Merlin,hN-aW4ktd1o
226,XRP and HBAR massive PARTNERSHIP,QcSqkuM9Mzo
227,INSANE ALL MAJOR US BANKS TO USE ONE STABLECOIN CBDC UNDER GENIUS ACT,19mI5aZ3xdg
228,🚨PREPARE $25 TRILLION To Enter Crypto Market SOON (CRAZY XRP RIPPLE RUMOR),0UVn3unPCsQ
229,Crypto History will be made in June! REGULATION,0seOf3LaCOg
230,MULTIBANK JUST DROPPED A NEW EXCITING PRODUCT $MBG,-KfHi-45mAs
231,Could this be the end of crypto in America?,SOWk6-ZUL04
232,3 Crypto Coins to Watch NOW! Time is RUNNING OUT!,CEODLNzDxNE
233,TARIFFS CRASH CRYPTO HERE IS WHAT YOU NEED TO KNOW,ekSRCWhHpmQ
234,🚨SHOCKING FTX SBF TRIES TO ESCAPE JAIL,9tyt7KrlDYw
235,Bitcoin Breakout on Valentine's Day? (Altcoin gains contingent),CPsJ2zOCOFY
236,$2.5B TRUMP BITCOIN BET – Supercycle Confirmed - ETH ADA XRP,5Rc9qYmYojQ
237,Could Crypto Taxes Change FOREVER? Lummis urges Treasury to REMOVE Unrealized Capital Gains,fEREONmvzIg
238,BITCOIN WHAT TO EXPECT IN Q3!,Ne6iT3A5h6Y
239,XRP and Doge ETF DELAYED! When will they be approved? #crypto #dogecoin #xrp,2oEMQWFkQkQ
240,TARIFFS PUMPED BITCOIN AND WILL KEEP PUMPING CRYPTO #crypto #bitcoin #cryptocurrency,afb1innGznQ
241,KEY FED MINUTES MEETING COULD PUMP CRYPTO #crypto #cryptocurrency #bitcoin,DxlHgvPI2BM
242,How To Invest In Crypto Full Beginners Guide,Yb6825iv0Vk
243,How To Make Money Using Coinbase (Beginners Guide),w-mD-W96yn0
244,How To Invest In Crypto Complete Beginner's Guide,IZWrAbFveSA
245,Ultimate Beginner's Guide to Investing in Stocks,86rPBAnRCHc
246,7 Crypto Altcoins I'm Investing In,dlVwb2UHw_k
247,How To Invest in Crypto Complete Ultimate Guide,LKczZI1OBAY
248,my plan to make millions in the crypto bull run in 2025 | 20x altcoin strategy for beginners,TnlN0Wny9GY
249,My Top 10 Crypto Altcoins to 10x This Bull Run,a-6ivXJ6H90
250,Top 10 Cryptocurrency To Invest In For 2023,FVPTZxBBlWs
251,Crypto.com Review (2023): Full Beginners Guide & Everything You Need To Know,K8qYdD1sC7w
252,Start Dropshipping with $0 in 2024 (Complete Beginner's Guide),MNcU-D2Dtro
253,REAL Experience Trying Out Amex Concierge Service,GvifnhBZdIU
254,Ultimate Beginner's Guide to Credit Card Points in 2025 [Updated],qu47ulGpHDo
255,7 Best Untapped AI Businesses To Start Right Now,2dTVGyf1cd4
256,The Powerball is a Waste of Money,FjjBk_NKFzI
257,Top 5 Crypto Narratives To Invest in 2024,AoZXDhMVYnc
258,my top 10 cryptos im buying before 2025 begins | don't miss these 50x altcoins,J9bus0-LWb8
259,5 Crypto Altcoins I'm Investing In 2024,cEQk0bs-w5Q
260,How to Make Millions This Crypto Bull Run | My Gameplan & Strategies Explained 2025,JZO2XnFfNEc
261,Top 5 Cryptocurrency To Invest In For 2021| MASSIVE POTENTIAL,aV3jrJHSKlA
262,My Top 10 Cryptos That I'm Going All In On.,t-yqOYCtHOU
263,How to Climb the Credit Card Tiers in 2025 (Beginner's Guide),Bo0KSb5ixUA
264,How to Invest in Stocks for Beginners [Free Education Course],rMMnk6Yvxic
265,BEST FREE CRYPTO APPS TO INVEST WITH,EmzGgyahdnw
266,How To Become RICH in The 2023 Recession (LIFT METHOD),7sAxjSHkKMU
267,How To Hyper Increase Your Credit Score in 2023 (800+ Credit Score),1TvYdE8AK-I
268,my high conviction altcoins for 2025,9TOZAfYSDxI
269,TOP 3 Crypto To Invest In 2021 / HUGE POTENTIAL,TbDKhn5stuY
270,My Plan To Make Millions In Crypto in 2024 | 100X Altcoin Strategy For Beginners,GHvxWlDoQEg
271,The Most Epic Short Squeeze In History FINANCE YT MEGA LIVE 🚀💎,o9GVHPlZSe4
272,How To Get the Amex Centurion Card (Black Card) [2023],ii73vhFEu4E
273,Top 5 God Tier Metaverse Coins To Invest In NOW,b9ONzl7UGTA
274,How To Earn Passive Income With Cryptocurrency,DZVobBowMuU
275,5 Altcoins I'm Buying During The Market Crash,b3XoFKeEoeg
276,TOP 5 CRYPTO TO INVEST IN NOW,d6aJpvw0oik
277,Top 5 Cryptos To Invest & HOLD in 2023,2JT1dRPOBA8
278,DogeCoin SNL Livestream REACTION,NkT_ZAU6GAI
279,How To Invest Your First $100 Into Crypto,WFQRXDqLUHY
280,Pionex Crypto Trading Bot | My Results & Step By Step Tutorial 2023💰,SWVKSHt5-Y8
281,How To Make $100 Per Day Trading Crypto 2023,hle6d3nIBEU
282,"Cryptocurrency, Explained",A20rysulIew
283,My Top 5 Altcoins to Watch in 2025 – How I’m Preparing for the Next Bull Run,tfkJYgNnj6U
284,How to Start Dropshipping 2023 (Ultimate Beginners Guide),_EHxGkCWRX8
285,Affiliate Marketing - How I Made $6900 per day (Step by Step Guide),Hljo6fK2fr8
286,Second Stimulus Check Update | My Predictions When Is It Coming?,ViJKY9CT2Pg
287,How to Invest in Crypto in 2023 - Full Beginner’s Guide,vaV7nWfNYg0
288,Amex Platinum Card - 17 Things You MUST Do Now,GZaZaIgRIHQ
289,How To Start Affiliate Marketing For Beginners | $5215 per Day 2023,ACfuGI6RtuY
290,Tesla Bitcoin CRASH is AMAZING News | HERE’S WHY,kxsCNoZJlGk
291,Top 3 Crypto To Invest In 2021 (DON'T MISS OUT!),1RMdpgmqAj4
292,Best Investing App For Beginners 2021,nuTzbsUvGaI
293,the last few days before market goes bullish again,YOEK3u3Le6Y
294,AMC War Room Talk Live on Youtube,YD4wtHTRkQ0
295,DogeCoin HUGE Trap?! (WATCH NOW) + SUPER ALTCOINS RISING,_3YSEBlSvjA
296,The Crypto Market CRASH | EVERYTHING YOU NEED TO KNOW,hy2ztUlDqwQ
297,$1200 STIMULUS CHECKS ARE FINALLY HERE 🤑😮| WATCH NOW !!,WYw0Km6IguA
298,10 Habits To Become a Millionaire,5QGU5I7sekQ
299,4 MILLION Stimulus Debit Cards Coming This Week 😱,qxrXEL0S3Ak
300,The REAL Reason Everyone's Getting Their $1200 STIMULUS CHECK But YOU 😡,kkfMhbIozO0
301,My Modern Apartment Tour,0g7upMjRM0Q
302,4 Best Beginner Investing Apps for 2025,udiTLB8BhUw
303,What Income SHOULD You Put On A Credit Card Application?,YXdHP7Pzxws
304,2021 CRYPTO EXIT STRATEGY REVEALED🔥😳,yHAbMGXoAgE
305,"Watch This Before Applying For American Express | (Major Updates, Rules & Guide)",btYOrjI4XdU
