,title,video_id
665,"URGENT!! BITCOIN MAJOR MOVE!!! DOLLAR COLLAPSING!!! $120,000,000 USDT MINTED!",1z1kRqhYbfI
666,BITCOIN FINALLY Ready for MASSIVE MOVE!! Bakkt DUMP IMMINENT or FAKE OUT?! 😱,kv8EJ0fr2y4
667,🚨 BITCOIN BREAKING OUT RIGHT NOW!!!!!!!! 3 MONTH DOWNTREND OVER!?!! [URGENT] 🚨,tzyrbw1UtH8
668,The BITCOIN Chart THEY DON’T Want YOU to SEE!!! DO THIS NOW: LIFE CHANGING GAINS!!!,2kMHxvqPmak
669,🚨 BITCOIN ALERT!!!!!! INSANE MULTI-YEAR PHENOMENON!!! THEY'RE TRYING TO KILL CRYPTO!![LIVE REACTION],s34jgFGy3-0
670,🚨 BITCOIN ALERT!!!!!! THE SECRET IS OUT!!!!! BTC PRICE WON’T PUMP UNTIL **THIS** HAPPENS!!!,8Vh4Mi_IW68
671,🚨 BITCOIN: HERE IT COMES!!! ACT FAST!!! MAJOR GLOBAL SHIFT?!! WARNING SIGNS...,scsP6p6ASa0
672,BITCOIN WTF?!!!?! THIS JUST GOT *SUPER* AWKWARD… WHAT’S REALLY GOING ON?!!🚨,lYLvz1kicCk
673,🚨 BITCOIN: THIS IS VERY CONCERNING!!!!!! A SCARY COINCIDENCE!!?!! [brutally honest truth…],7noVW66uO9c
674,🚨 BITCOIN EMERGENCY!!!!!!!!!!!!!!! MASSIVE DELEVERAGING NOW!!!!!! [this is NOT okay] 🚨,GaBBtsfvdXw
675,"BITCOIN FLASHES SUPER BUY SIGNAL!!! 🚀 $10,450 NEXT!? BTC OVER $20k THIS YEAR!!!",5aQumGnI2DY
676,BITCOIN PARABOLIC NOW!!! NO MORE DIPS!!? [PROOF] BTC IS JUST GETTING STARTED!!! 🚀,pCrTOdqcrZQ
677,BITCOIN WINDING UP!! HUGE MOVE INCOMING!!? $BTC ETP LISTED on STOCK EXCHANGE!!,IaCO7xw-TLo
678,BITCOIN: Was THAT the BIG “Bakkt Dump”? Altcoin Rally OVER?! $BTC ETF Cancelled!?,fsZkFRYQEmg
679,BITCOIN & ETHEREUM SET TO EXPLODE!!! HUGE USA NEWS!! WARNING: BTC SHORTAGE POSSIBLE!!!,J84pQtVIJtg
680,Bitcoin……… it’s over?,rxDNevYB2-E
681,BITCOIN Bounces Back!! $30k BTC MINIMUM 2020? BREAKING: Michael Bloomberg Crypto Clarity,rk2QrOtYeZo
682,BITCOIN: BULLISH NEWS!!! This Could SURGE BTC to $20k!!! There’s Just ONE BIG Concern…,7cqMW3tWdhw
683,🚨 BITCOIN: MAJOR SHIFT RIGHT NOW!!!!!!!! LIKE NOTHING SEEN BEFORE!!!!!!! [72 hours and counting…],aUwQpxPHVjw
684,🚨 Bitcoin: It’s About to Get VERY SERIOUS!! What They’re NOT Telling You [watch before Monday],OQqRI1EMNlo
685,Bitcoin BREAKDOWN?! Altcoins PUMPING!? 2017 'COINCIDENCE' Hints to NEXT MOVE!!,tqPG2LbiAxM
686,🚨BITCOIN ALERT!!!!!! THIS IS ABSOLUTELY HISTORIC!!!!! COINCIDENCE?! [WARNING]🚨,CYEpLo8cfro
687,WOW!! ‘BITCOIN HALVING' Trends SURGE!! 🚀 Stablecoin BAN Proposed!! DeFi in TROUBLE?!,hRV8A8UTR3s
688,🚨 BITCOIN WARNING!!!!!! THIS WILL SEND SHOCKWAVES!!!!! [48 HOURS MAX] HURRY!!!!! 🚨,1jLmlcr7Qzc
689,BIG News for BITCOIN!! $60 MILLION USDT MINTED... What For?! NEW US Crypto Tax Bill,W-nDkKO8sY8
690,Is FED Actually About to DESTROY Bitcoin?! The Game Has CHANGED [it won’t be easy],12ZyWCY-LYc
691,ALERT!!!!!!!! BITCOIN BREAKOUT NOW!!!!!?!! BUT… THIS IS VERY SCARY!!!! [watch fast]🚨,wX4_IbxeDpU
692,🚨 BITCOIN!!! ARE YOU PREPARED FOR THIS?!!! BE HONEST!!! #bitcoin #btc #bitcoinnews #crypto #shorts,nMoEmw0fPLI
693,Is Crypto DEAD?!? What Went Wrong & Why Does Good News NOT Affect Price?!?,C_MDCAke5u8
694,Was THAT the LAST Chance to Buy CHEAP Bitcoin?! Will $BTC Dump AGAIN?! [BTC Fundamentals],V_6zQmeotUU
695,🚨 THEY WILL SEIZE YOUR MONEY IN 2023!!! #GeraldCelente via Stansberry Research #bitcoin #gold #cbdc,gHu850RLBeo
696,🚨 WOLF IN SHEEP’S CLOTHING?!!! What are your thoughts about the new #Ledger Recover?  #bitcoin #btc,zcVv3Juk3sM
697,$XMR Hard Fork: 4 MORE Moneros?!? $NEO Tour | 🤑 BlocNATION Airdrop | $ONT Supply? | $PPT x $KMD,ezyx3Uo-bFU
698,All Cryptocurrencies Are NOT Created Equal | A Guide To Digital Assets | $BTC $ETH $BNB $USDT $SDT,iJ3ouLET85g
699,The Truth on Hamster Kombat: Revolution or Scam?,NoUfrYD6M7k
700,"""The guards in prison asked me what coin to buy"" | CZ Interview",wYE8XSMau8c
701,"Steve Wozniak: ""What an Incredible Thing Bitcoin is""",Z7apkWvlDxk
702,Arthur Hayes Reveals the 'Perfect Time' to Buy Crypto,Jm78PXsaVzg
703,Cryptocurrency vs the World’s Wealth,mRmKmhYiHqU
704,Learn to speak crypto with Cointelegraph,30cUDc0dvHU
705,Top 10 Richest People in Crypto,m_hGOlxoyo0
706,ETH to $10K this cycle: Will Ethereum outperform Bitcoin? | Price analysis with Scott Melker,gULGkL5lasc
707,"What is Cryptocurrency? Virtual Money, Bitcoin and Altcoins | The main features and types",K5Ncpv7vPe8
708,Is the Crypto Bull Market Over? Kevin O'Leary Breaks It Down,2eXsTN1kRCU
709,Macro Factors May Drive Bitcoin Up 100x in Next 5 Years | Interview with Raoul Pal,eMCkiG9FRjg
710,Asking Dubai Crypto Tycoons How They Got Rich,d7tL4gxoWFw
711,Macro factors can propel Bitcoin to $1 trillion market cap  | Strategic investor explains,RaZMLZS1tog
712,History of Cryptography | A Cointelegraph Documentary,RTDYRl1uaMI
713,WHY DID THE CRYPTOCURRENCY MARKET CRASH?,fN8Rg4FckM8
714,"The Dow Crashes, Bitcoin Crashes | Hodler's Digest",W5rCULlKszQ
715,Why Bitcoin Can Still Hit $100K in 2021 | The Moon & Tone Vays,InvK5RrW2gI
716,How a Pakistani celebrity and crypto billionaire challenged his government | Crypto Stories Ep. 7,eZ0dFzxXTV4
717,How Crypto YouTubers Become Rich: All Secrets Revealed!,uwY6xsaRamc
718,Bitcoin Bull Run 2024: What Makes This Time Different,2UaDfyqxYjE
719,"CZ: Bitcoin Price, AI's Role & What Founders Should Actually Build | CZ at Token2049",JeG7vSPG2gY
720,The Most Dangerous Crypto Scam: Victims Speak Out,t06mVWz6ngM
721,When Will Altcoin Season Start? Key Signs to Watch,1IYxu9W47to
722,Blockchain Games: Fad or Future?,1xOM1NreoeE
723,Ethereum Is Dying... Or Is It a Hidden Gem for 2025?,FWo0hw_94a4
724,How Thailand went from a tourist paradise to a crypto tech-giant | Cointelegraph documentary,Wjs2kxHDExg
725,Is Sui the new SOL? Why you should NOT ignore it,P2CJZxeXCIk
726,Bitcoin to $20K by Year End?  | Alessio Rastani Vs. Charlie Burton,LReFIIHjBGc
727,How Charlie Shrem Became a Bitcoin Millionaire | Crypto Stories,oXn5WvMhaqA
728,HISTORY OF MONEY | What is Bitcoin? Where did cryptocurrencies come from?,d-T-RM7g1h0
729,What is a cryptocurrency? Explained with animations | Cryptopedia 101,KltWJERR6u4
730,The 4-Year Bitcoin Cycle Is Broken. Here’s What Comes Next,hb0z1Ti8Uys
731,How to keep your crypto safe in 2023 | Analyst explains,F0qH0zWLh4o
732,Altcoin of the Week | Ripple XRP,iWPIYxtLwpo
733,Bybit Hack EXPOSED: Inside North Korea’s Cybercrime Empire,NDv0RfehETQ
734,Adam Back on Trump Tariffs and Why This Is a Good Time to Buy Bitcoin,vT-fVbixtik
735,Cardano founder Charles Hoskinson explains Ethereum’s and Bitcoin’s flaws,4nV3PC47G9k
736,Bobby Lee's Crypto Portfolio | Cointelegraph,QThtqJvbKUw
737,Top 5 Places You Can Spend Your Bitcoin,6Po6rmcRWdY
738,Crypto in 2025: Which Coins Will Dominate? (Top Predictions!),ndnRYF5nlkw
739,Crypto Lending: The Ultimate Killer App? | Cointelegraph Report,cDyq4ewsrSE
740,How Low Will Bitcoin Fall? | Eric Krown vs. Joe DiPasquale,Lcbg3-0oQUA
741,How does MicroStrategy buy Bitcoin - Explained in under 3 minutes,ae_eNJRbDdU
742,Bitcoin to $10 million: the rise of the Bitcoin aristocracy? | Interview with Dan Held,fqYsUInhDeY
743,Bitcoin conference and a bad trip to North Korea | Crypto Stories Ep. 10,MQj9248C7Uc
744,Why Alex Tapscott quit his high-paying job to write a book about Bitcoin | Crypto Stories Ep. 14,-fmHuNv2jmw
745,Why Gavin Wood decided to code Ethereum | Crypto Stories Ep. 5,KRXRqCtcSGU
746,Cointelegraph Crypto Traders Live | World’s Largest Live Crypto Trading Event,vYeKVcxc4DU
747,How to set up a cold wallet in just 6 minutes | by Arculus,CdWzY5T62NE
748,"$8K Is Bitcoin's Next Target, But Will a Plummet to $3K Follow? | Charlie Burton & Clement Ip",whBMKyndGF8
749,IT Analyst Jason Bloomberg: What I’m Really Saying Is ‘Shut Down Permissionless Blockchains’,vEJuF2NRTAw
750,Bitcoin’s ATH Is Just the Start - Ran Neuner On What Comes Next,nE-mnQiy8y4
751,IBM — Blockchain Revolution From the $140 Billion Company,hcvNICp-MWo
752,Bitcoin Market Crash: Why It May Be Only the Beginning,-_q8kQrIdXA
753,"FTT, Bitcoin crash EXPLAINED: Binance acquires FTX?",7-FTQ-fqRSQ
754,Week of Altcoin: DOGECOIN |Such Crypto! WOW | ft. Shilling,u7duP_wJ_Aw
755,Is Bitcoin a Safe Haven for Your Money? | Inventor of Yield Curve Signal Explains,ExYxgsevFio
756,Time to Start Buying Bitcoin Again? | Crypto Markets,-Q9BKSiD5mI
757,"Bitcoin Miami 2021: Inside the 50,000+ attendee event",gYGfQA6vSUE
758,"Crypto in the USA, Part I: Introduction | Cointelegraph Documentary",i6uz4MFtHIo
759,How Portuguese street artists are turning graffiti into NFTs | Cointelegraph Reports,keOJtx5VZv8
760,Bitcoin on the battlefield: How Ukraine is utilizing crypto | Crypto Stories Ep. 9,g4rXZVcq-BM
761,What is a DAO? All you need to know about decentralized autonomous organizations | Cryptopedia,ISSGwL7P9cc
762,What is Binance CEO most excited about in 2022? | Interview with CZ,wFfglhUiMBo
763,Futurist Explains 5 Keys to the Next Crypto Boom,nnaEDPYXzGw
764,BREAKING: Spot Bitcoin ETF Receives Official Approval From The SEC,zlwkrHLi-tQ
765,Bitcoin Price Explained,ce9f7nvAjR4
766,"Crypto Rally, Elon Musk Bullish on Bitcoin, Buterin’s Cryptocurrency Fortune | Hodler’s Digest",LtnMl1XY3y4
767,The pound and euro crisis: What does it mean for Bitcoin? | Alessio Rastani,xDliiHpe39c
768,Mantra CEO: Trillions in Real World Assets Coming to Crypto!,aV4BeOOAjDg
769,Pierre Rochard Vs. Jorge Stolfi: Is Bitcoin a Ponzi? | Cointelegraph Crypto Duel,MbOkkyoUilk
770,Bitcoin Cash Is Something Worth Stealing — Roger Ver on $45-Million Hack,WoRHrl97sns
771,Which crypto assets will dominate 2022? | Bloomberg Analyst’s crypto outlook,WUm-T8OVw0Q
772,Fastex Showcases the Future of Web3 at Paris Blockchain Week 2025,-OilYhoLRq8
773,What is blockchain? Explained with animations | Cryptopedia 101,rCjVfuR93dk
774,Altcoin Prices SURGE and DROP in 24 hours | Pump and Dump Whales to Blame?,rn9zMdLq9Es
775,"ETH 'could EASILY sustain until $5,000:' Key Ethereum price metrics behind new highs",hvQmYB3y9ms
776,Inside Blockchain Capital | Top Crypto Venture Capital Fund,htaTy_TMtKo
777,What is Blockchain? How Blockchain technology works explained,MhgunVQr_G4
778,Exploring DeFi on Bitcoin: Mintlayer AMA,Sbiwtl4YE0g
779,Crypto Bull Market Phase 2: What to Expect,LtvwC5sHjgw
780,"PewDiePie on the Blockchain, Is Bitcoin a Bubble? | Hodler’s Digest",wZk-JcwHglg
781,The BULL RUN has Begun: Mark Yusko's BTC Price Prediction,XkC4Gm5u5qM
782,Has Crypto Won Already? Scaramucci on XRP vs SEC,04FR7Y42J5U
783,Interview With Bitcoin,RJr64_m2Jwk
784,Is Cardano a “Dead Coin” or a Massive Opportunity?,0ZXqyg6D-R4
785,Ethereum Co-Founder & Bitcoin Professional Charles Hoskinson at Cointelegraph channel,ajqchlphOGs
786,He made an NFT card game in 2015...Now it’s worth Millions | Crypto Stories Ep. 6,mOevAtQRkGM
787,Tom Lee’s Bullish Outlook & JPM Coin Bombshell | Hodler’s Digest,K1hS3y1BtTY
788,Why NFTs are 'ten times better' than traditional art | Interview with $69 million NFT buyers,IKsB8dmkuoA
789,Trump’s Impact on Crypto: A Blessing or a Curse?,jMQj01_zKA8
790,What you need to know about all Ethereum upgrades (and the Merge),Kt3q6MNRLiQ
791,Real-World Asset Tokenization Booms in the UAE! - Fastex Leads the Charge,tYO993T72ms
792,Breaking News! Bitcoin is Breaking Out. The Price is 10k USD. What's next?,LGmtWZkToss
793,"Interview with Scott Melker: MicroStrategy bought another 480 BTC — Should you buy, too?",Kqdf8hvvBjw
794,Is This the End of the Crypto Bull Market?,BROTohqI42M
795,Who Steals Your Bitcoin? | Is Gold Better Than Bitcoin? | Hodler’s Digest,2jIvtMN5X_s
796,Michael Cera introduces LITEPAY for LITECOIN (LTC) | ALTCOIN OF THE WEEK,0m1YirYKaGM
797,"Editor’s Choice: Trump’s Crypto Vision, Polygon’s Major Upgrade, Bitcoin’s Hashrate Record and More.",_9TfO2xPe1o
798,I Survived on Bitcoin for 14 Days | Cointelegraph Documentary,HpwETE2m57A
799,Analyst’s honest opinion on BlackRock ETF Bitcoin approval,UkJ3JYFpxjA
800,4 Reasons Why Bitcoin Is the Least Uncertain Monetary Asset | Kraken’s Bitcoin Strategist Explains,WESZN_fEaHI
801,Vitalik Buterin: Blockchain for Good | BlockShow x SFF,s8UrVa6_Tyo
802,Will you make another turn with us?,i_WTAqqif4Q
803,"Bobby Lee: ""I am a Bitcoin Maximalist""",CzOX_fJ2Y-4
804,STELLAR LUMENS | Simply Explained ft. Emma Stone,03uigo-uUfk
805,Stacks 2.0 Launch Event Stream | STX,LSewk_UU9SA
806,"Blockchain Jobs, Bitcoin Adoption in Switzerland and North Korea | Hodler’s Digest",0EWdshY7uFc
807,What will trigger crypto’s next 10x growth? | Interview with Harmony COO,IBpzKfslAXo
808,100 Years in Jail?! SBF Trial Verdict Explained,_vWUlHcMK1E
809,The Truth About Bitcoin in 2024: Are Your Investments Safe?,WzXZiDdfN8k
810,"Bakkt to the Near Future, DJ Khaled Gets Away with Another One | Hodler's Digest",ppqvsKqmqPc
811,"51% Attack, Free Speech Under Attack? | Hodler's Digest",YB-RL1IMe6k
812,Charlie Shrem's Way to Bitcoin | From Millionaire to Felon & Beyond,xDjkXgCVTdo
813,Why Tether Said NO to MiCA | Exclusive Interview with Paolo Ardoino,ZIIRHv3cbog
814,O3 Swap AMA: The cross-chain protocol that sources liquidity from multiple networks,5JB723BLEwQ
815,"Blockchain Bandit Detected, Disney & Crypto, Samsung Develops Native Coin? | Hodler's Digest",WM02QY5ATWI
816,"CCN Back in Business, Catholic Crypto, Bitcoin’s Carbon Footprint | Hodler's Digest",Zb80IogbMEs
817,NEO's Smart Economy | Why do you HODL?,qM7R0bs0daE
818,"Bitcoin SV News, Forbes Blockchain List, Notre Dame Des Cryptos | Game of Hodls",HSW4HDFjqO4
819,‘Bitcoin is not designed to be leveraged’ | Exclusive interview with Caitlin Long,xJDt3_biNJc
820,How Can You Prepare for Bitcoin ETF Approval?,TBgH87uC6dY
821,Solana: Expectation Versus Reality,0XzRHlu5A7I
822,"BTC aims at $50K; Is ETH 'sound money'? ADA, ZEN, AVAX | The Market Report w/ Charlie Burton",d0s7T5AlxQU
823,"Bitcoin Is Down, but Markets Get Stronger | Crypto Markets",fI2BF1nKSVY
824,"Join Tim Draper, Meltem Demirors, Balaji Srinivasan, Dan Morehead & Others Part 1 | Unitize",QgntfQ0gFo8
825,5 Key Steps to Win in Bull Markets | with @EricKrownCrypto,dA9-xYMGHBk
826,"Mike Butcher: ""We are looking for the decentralized players of the future""",IrwlnSa4tZw
827,How bad is the FTX collapse for Bitcoin? On-chain analyst explains,3bsSOpqKaHY
828,"Disney building a park in the Metaverse, PayPal explores stablecoins | The Crypto Minute",WXPZvNBr8JQ
829,Welcome to BlockShow powered by Cointelegraph!,xjWr1-HU6M0
830,Scott Melker: Bitcoin will hit $100K in a month if Amazon buys,4xDjVqlxsQU
831,SBF allegedly paid a $150 million bribe to Chinese government officials,kU0mm3feamU
832,What is Vechain? | Jerome Grilleres Explains,Awx-nwagBuk
833,What Are the Best Countries for Crypto Investors?,JfsGx4upGFw
834,"Leaving TradFi in the dust, Crescent defines DeFi",fs_VLBFtCyY
835,"Avengers of Crypto, Tether (USDT) Only 75% Tethered, Elon Musk & Ethereum | Hodler's Digest",aRgQVtJo1Yk
836,Can Bitcoin become the world’s reserve currency? | Exclusive interview with Dan Held,1Ffw8s1h-TY
837,How will the Shanghai upgrade impact ETH’s price?,mLWYfUSnFrA
838,BREAKING: Bitcoin breaks ATH!! Where will it top? | The Market Report w/ Sam Bourgi,RcAmuMJOj1Q
839,"Largest Dusting Attack in Litecoin History, Ponzi Scheme Causes Bitcoin Crash? | Crypto News",S4FxyUvfMe0
840,Will the past catch up with presidential candidate Brock Pierce? | Interview,HMiWxlV-OYA
841,NEO and GAS Explained (UNDER TWO MINUTES) Baby Driver Edition,vyS_q0NvyyY
842,Meta (Facebook) CPO Chris Cox and Insider's Nicholas Carlson on the metaverse | Web Summit 2021,ZnepsHBbbdA
843,Naeem Aslam:  “I am a bull. I am completely a bull”,P0WOU1lTzBw
844,Bitcoin continues consolidation: Are we still in a bull market? | The Market Report w/ Ran Neuner,1bDhftwbbJA
845,How blockchain can transform multi-trillion dollar industries | Alex & Don Tapscott Explain,gJUum8BWkRo
846,OpenSea CEO explains why gaming is the most exciting use case for NFTs | Interview,mELHsqXjdnQ
847,"Tom Lee: ""Bitcoin Price Can Retain Its Old Highs""",uv9fyNAbVBo
848,"Justin Sun’s $4.5 Million Dinner, SEC vs. Kik, LocalBitcoins Stops Cash Trades | Hodler’s Digest",UIqXPbl2Cy8
849,How to invest in crypto in 2023 | Interview with Jeff Dorman,Rw9GzHZklDQ
850,How blockchain can transform multi-trillion dollar industries | Alex & Don Tapscott Explain,gJUum8BWkRo
851,OpenSea CEO explains why gaming is the most exciting use case for NFTs | Interview,mELHsqXjdnQ
852,"Tom Lee: ""Bitcoin Price Can Retain Its Old Highs""",uv9fyNAbVBo
853,"Justin Sun’s $4.5 Million Dinner, SEC vs. Kik, LocalBitcoins Stops Cash Trades | Hodler’s Digest",UIqXPbl2Cy8
854,"Tether, Untethered | Hodler's Digest",O0q2PcGrdZw
855,"Ethereum Tied to Bitcoin? Libra’s Future at Risk, Crown’s Market Analysis | Crypto News",AgWpTK7-tjQ
856,“I don’t have cash.” — Dan Tapiero explains his portfolio for 2022 | Interview,zmbVPM_UOv4
857,"ICOs, Bitcoin's Growth and The Blockchain Community: An Interview Ivan on Tech",Fv7aA0ESkLw
858,Farming Revolution: Blockchain and Tech Solutions by Dimitra,xutrxP29PO8
859,"Bear market? “So what,” says greatest chess player of all time",1Tx1Dvt9eK4
860,How de-dollarization will spark the rise of Bitcoin and gold,qmQKA4OTfig
861,How Trump’s Bitcoin Adviser Is Building a $710M Crypto Empire,VZ6Hj457iWs
862,Blockshow Day 1! Report,CmrBH8_ixFo
863,Bitcoin congestion: Are ordinals breaking BTC?,jtWj8xisHgc
864,"Terra, Celsius, 3AC: How dangerous is the crypto market contagion?",0jqhqzpMv-w
865,Koii AMA: The blockchain project built for media,DGH8SE88ezg
866,How Bitcoin netted Peter McCormack's childhood dream to buy a soccer team,VGYItQKWpq8
867,"Why a Trump Presidency Could Spark an ""Altcoin Explosion""",ICIcL8aGB_E
868,Disrupting the Payments Industry | Inside PumaPay,BDBv-md-Irg
869,How the U.S. SEC is waging an undeclared war on crypto,CsmfziHJA0I
870,"Crypto unicorns debate on DeFi, scalability, and interoperability | CV VC livestream",HB9Aufvg8m8
871,"Brexit, Bill Clinton & Blockchain | Hodler's Digest",XwFbOMbI6qQ
872,"Web3 searches hit ATH, Bitcoin gifting, SHIB & DOGE most popular coins of 2021? | The Crypto Minute",2w266FODzkM
873,"Russia's central bank calls for ban on crypto, Microsoft’s metaverse move | The Crypto Minute",lqAZPbtTAeg
874,Silvergate collapse: What does it mean for crypto?,sG5_NGnPpEg
875,"Inflation at 40-year high, Bored Ape NFT sold for $3K, gift BTC on Cash App | The Crypto Minute",8avBEsk_G4Y
876,Bitcoin NFTs — What are ordinals and why are they booming?,D_mjl023FCs
877,"Bitcoin, Gram, China - Libra, Libra, Libra! | Crypto News",H3QZG3eYUzw
878,"How Is Media Impacting Bitcoin, JPM Coin & Book on Ethereum | Ex-Bloomberg Journalist Explains",NkW1rFy096g
879,APENFT Marketplace: A zero-fee NFT ecosystem for everyone | AMA with David Uhryniak,bcD0eWovJGI
880,How Grayscale plans to launch the first Bitcoin spot ETF by July 2022,fTLvifs8f2I
881,Superbid AMA: Beginning the crypto revolution with the biggest influencers in the world,guPI3zLv02k
882,"CeDeFi, MetaFi, TradFi, and other opportunities for crypto hodlers | AMA with YouHodler",1WNDW3nihiQ
883,Seoul Office Launch Party,E--wTNbbxZs
884,Shiba Inu (SHIB): Meme coin or crypto revolution? BTC ETF | The Market Report w/ Eric Balchunas,fvF0AwVTWxw
885,How ETH 2.0 could become the VISA of crypto,Q11sgp58weI
886,TOP 5 People in Blockchain,W9ppF-n_zQA
887,"Bitcoin’s Peak Hash Rate, Booking.com Predicts Global Adoption | Crypto News",_daXFXJRv0Y
888,Artificial Intelligence Explained | Interviews with Experts,vZut-IbcoQk
889,Why Prince Philip of Serbia is bullish on Bitcoin (not crypto),y_MqqTCRok8
890,$3 billion stolen in hacks — Why are crypto crimes surging?,kyNQ5YoFkWo
891,Cointelegraph Platform: CV-Labs “Bitcoin Halving View From The Crypto Valley”,pxaFRq9U8-Q
892,"ETH and DOT make all-time highs, Burger King giving out DOGE, McRib NFTs | The Crypto Minute",cnHfmSQC-JY
893,Top coins to buy in a bear market | The Market Report,2nGJnbalmjA
894,Why token emissions are key for investing in DeFi projects | Interview with Shane Molidor,iYtko0Ni238
895,How the metaverse will reorganize humanity into global tribes | Interview with Yoni Assia,Q7h3nKStIik
896,HATHOR AMA: Solving green Bitcoin mining with the merge mining Hathor.Green initiative,y8rVS_vdfto
897,Should you hold Bitcoin or Ether in the long term? | Interview with Mati Greenspan,KPo7syaRPUM
898,"El Salvador buys the dip, former Google CEO advising Chainlink, BitMart hacked | The Crypto Minute",43IV--hmY_0
899,This Isn't Fun But It Makes Me $2k A Hour,dhatfTp0LRg
900,5 Crypto Coins That Will 15x In DEC (Last Chance),QzDtc8OSroU
901,Why I'll NEVER Play Video Games Again After Learning This,868BlSS8Wg0
902,"RICH KID BUYS 1,000 OVERWATCH LOOT BOXES : SUMMER GAME LOOT",6x6v-BsCGiM
903,Want To Be Rich? Give Up These 4 Things…,KYLnXG4pU4s
904,How To Make 100x With TINY Crypto Coins (Full Guide To Micro Cap Trading),IjolnNa9tWw
905,"I Made $832,000 Flipping NFTs (Full Advanced Guide)",HIf2ecpTQ0A
906,7 Crypto Coins That Will 15x Early 2022 (Last Chance),xmuJ8n39Kwk
907,This Made Me Quit Alcohol Forever (You Will Too),tEWweaj_Zyo
908,How Dopamine Detox Saved My Life,eBPsWni-3Fs
909,NO-FAP NIGHTMARE MODE RESULTS (AGING BACKWARDS),7XX80DaKIgI
910,4 Crypto Coins That Will 25x In Jan (FINAL Chance),QbBqI_4AS9o
911,Crypto Gaming Will Make You A Millionaire. Use This Guide.,7qDsK_a9rcg
912,5 Crypto Coins That Will 15x In 30 Days (Urgent),jLdF2qt_uWQ
913,Why I'll NEVER Drink Caffeine Again After Learning This,y_xA70lWrDs
914,6 Crypto Coins Set To 30x Nov 20th (2 Week Warning),rUFAEslz84k
915,7 Crypto Coins LIKELY To 11x By NYE (Last Chance),Pbp_ZgYZoZM
916,These 11 TINY Crypto ALT Coins Will 50x In DEC (URGENT AF),Qce6M1xJ4zk
917,Why (As A Millionaire) I Own NOTHING,4Vp_9E8G4BQ
918,These Crypto Coins Are True 100xs In 2022 (Yes Really),mAaXdIg2Q2k
919,DUMP ALL CRYPTO Before Bitcoin Does This (HUGE Crash : 2025 Bull Guide),smhbENZS8gE
920,DUMP IT! Sell ALL Crypto & Bitcoin Before This Crash (HUGE Warning Signs Selling 101),7KaRdNPEoI4
921,These 7 Crypto Coins Will 20x In 14 Days (Urgent),krfz4WU5_lM
922,8 NEW Crypto Coins 20xing Nov 24th (LAST BUY CHANCE),Dwnmzz7MbMw
923,These 15 TINY Crypto AI Coins Will 30x BY XMAS (URGENT AF),HyziGxIa3Fs
924,TOP 9 AI Crypto Coins That Can 100x By May (Pump SOON List),IP0WbSuK2sU
925,This Crypto Crash Will RUIN Lives (Actually Urgent),nR5JKbwWQBo
926,The Science To Destroy Low Motivation,j1WTP4Q7KGE
927,I Sold ALL My Crypto & Stocks. Get Out NOW.,ednbinYuoy0
928,My Biggest Crypto Buy EVER (Expecting 110 Million Back),6WMMaMamp_A
929,3 20's Mistakes That Will Make You Poor In Your 30's,eVgFzmC2lAI
930,5 Crypto Coins That Will 15x In March (URGENT ACTUALLY),jQQu8wX8Q1k
931,DUMP IT! EXIT ALL BITCOIN and CRYPTO Before This Crash (Pre 2025 Crash Selling Guide),A8zbCQ6qHP0
932,This Will Kill BITCOIN In 2022. (Dec 22nd),AiZz7WvZtiY
933,The WARNING Signs Of “Dopamine Toxication”,v_mvvKwNwho
934,DEATH TRAP : Crypto Set To NUKE. DO THIS NOW (2025 Pre Bull Guide),doqj-7QThv8
935,Idiots Buy Homes. Do This Instead.,0BIozLE1kLg
936,"These 7 Cryptos Will 50x, I'm Investing Millions (Urgent)",4fQhNVcg6jc
937,"Why Biz ""Gurus"" Keep You Poor & Stuck",i0MiTdF5aQo
938,These 7 Crypto Coins Will 15x In DEC (Last Chance),BhrweqBVt1k
939,4 Crypto Trades That Will 10x By Jan (Last Chance),M86DdMzJERc
940,13 Crypto Coins That Will 15x Early 2025 (URGENT AF),eBxDLWgmy0Y
941,I'm Buying Millions Of Crypto. You Should Too.,W5PBB4Xem4Y
942,5 Crypto Coins That Will 15x In May (Last Chance),95lSNn0Er_Q
943,6k In. 20 MIL out. The Best Investment Of My LIFE,9rm1vjaeKr0
944,EXTREME Minimalist House Tour,32w1xnOqSPo
945,How To Make 100x With TINY Crypto Coins (2024 Guide For Micro Cap Trading),D1jqkqbVEz8
946,3 Unfair Tricks The Super Rich Abuse,p2LgY0laA8E
947,4 Skills That Can Make Nearly ANYONE Money Fast,2aCRnWpvl5A
948,SELL BTC: These 7 Crypto Coins Will 23x By 2025 (Still Early),JgjGJTrL3hY
949,How I Used Addictions To Make Millions,nrf489UDXMU
950,How I Mastered Coding Games In 23 Days As A TOTAL BEGINNER,mmnwkv15BSY
951,I'm So Sick Of Crypto Currency,z0nI12yQ_bQ
952,"This 3am Daily Routine Unlocked My ""God Mode"" Focus",zsBLE5Zv67Q
953,How To Make 100x Flipping Metaverse Crypto Coins (Full Guide Metaverse Investing),ftNf3GM5EFE
954,How Games Can 100x You and Break Reality,UPpnXuVZWIE
955,"They Are Paying Me $110,000,000 For This..",QIi9DY3gD14
956,TRUMP DID IT! These 7 Cryptos Will 20x In June,YybK5V3Xqk0
957,CRASH! These ETH Crypto Coins Will 15x In Feb (URGENT AF),2ZJ0v1vXKFY
958,Trump Did It! DUMP ALL Bitcoin & Crypto Before THIS,0qitQoWgTaQ
959,The Dark Tactic I Use To Stay Super Motivated,5w6GLvaAdCQ
960,The 32 Crypto Coin Portfolio That Is Making Billions In 2024,yshWpJFQ6nM
961,These 3 Crypto Coins Will 30x By June (Yes Really),G8Dm2ihWY4w
962,7 Crypto Coins That Will 20x Early 2024 (Last Chance),fE2FRzFzvik
963,DISGUSTINGLY Easy Ways To Get Rich With AI By 2024,7pSYfK5MQnU
964,RESULTS : 30 Days NO CAFFEINE Changed My Life,mGDA_Sn_5OA
965,🔴These 8 TINY Crypto ALT Coins Will 50x In May (URGENT AF),M1P0KwqDPTc
966,"It's Gross, But It'll Make Even Beginners Millionaires By 2024",YbMAZeg75ug
967,Stocks and Crypto. STAY OUT NOW! (Actually Urgent),6gWWeoa6slE
968,TOP 11 AI Crypto Coins That Can 25x By Nov (Yes Really),VJmvOii86Ok
969,WAR IS HERE! SELL ALL BITCOIN AND CRYPTO NOW!,AXzwTKiqSus
970,These 7 Crypto Coins Will 13x By MARCH (Last Chance),SEzNf17PYiQ
971,LEAK! Whales Dumping BITCOIN (Actually Urgent),0HqPURG2D5c
972,My 100x Gaming Crypto Portfolio Broken Down,Y6bCPm1uWwU
973,7 NEW Crypto Coins That'll 100x By May (Pump SOON List),Vmg7BZ4LfOU
974,TRUMP JUST SENT CRYPTO NUCLEAR! Buy These 8 Coins NOW (URGENT AF),YMUpa4vkM7c
975,I Spent Millions On Garbage,8XGLiV_QVHM
976,7 TINY Crypto Coins That Will 15x Mid 2024 (Last Chance Before TRUE Bull Run),G2UF_uRPROg
977,How To Make 100x With TINY Crypto Coins In 2025 (Full Guide To Micro Cap Trading),F-Cx4m-Fu3o
978,These 5 Alt Coins Will 20x In 15 Days (HUGE Events),snwisD6t2Pg
979,"It Started, This Will BREAK Bitcoin & Crypto (Do This NOW)",6rdsSTZkG_k
