,title
769,"ETH 'could EASILY sustain until $5,000:' Key Ethereum price metrics behind new highs"
770,Inside Blockchain Capital | Top Crypto Venture Capital Fund
771,What is Blockchain? How Blockchain technology works explained
772,Exploring DeFi on Bitcoin: Mintlayer AMA
773,Crypto Bull Market Phase 2: What to Expect
774,"PewDiePie on the Blockchain, Is Bitcoin a Bubble? | Hodler’s Digest"
775,The BULL RUN has Begun: Mark Yusko's BTC Price Prediction
776,Has Crypto Won Already? Scaramucci on XRP vs SEC
777,Interview With Bitcoin
778,Ethereum Co-Founder & Bitcoin Professional Charles Hoskinson at Cointelegraph channel
779,Is Cardano a “Dead Coin” or a Massive Opportunity?
780,He made an NFT card game in 2015...Now it’s worth Millions | Crypto Stories Ep. 6
781,Tom Lee’s Bullish Outlook & JPM Coin Bombshell | Hodler’s Digest
782,Why NFTs are 'ten times better' than traditional art | Interview with $69 million NFT buyers
783,Trump’s Impact on Crypto: A Blessing or a Curse?
784,What you need to know about all Ethereum upgrades (and the Merge)
785,Real-World Asset Tokenization Booms in the UAE! - Fastex Leads the Charge
786,Breaking News! Bitcoin is Breaking Out. The Price is 10k USD. What's next?
787,"Interview with Scott Melker: MicroStrategy bought another 480 BTC — Should you buy, too?"
788,Is This the End of the Crypto Bull Market?
789,Who Steals Your Bitcoin? | Is Gold Better Than Bitcoin? | Hodler’s Digest
790,Michael Cera introduces LITEPAY for LITECOIN (LTC) | ALTCOIN OF THE WEEK
791,"Editor’s Choice: Trump’s Crypto Vision, Polygon’s Major Upgrade, Bitcoin’s Hashrate Record and More."
792,I Survived on Bitcoin for 14 Days | Cointelegraph Documentary
793,"Impeach Trump With Crypto, Ethereum Fork, McAfee 2020 | Hodler's Digest"
794,Here’s How the Trump Family Manipulates the Crypto Market: Dan Held Interview
795,"Bitcoin, Ethereum, EOS: Is the Future of Finance Decentralized? | Crypto DeFiance 2019"
796,Analyst’s honest opinion on BlackRock ETF Bitcoin approval
797,4 Reasons Why Bitcoin Is the Least Uncertain Monetary Asset | Kraken’s Bitcoin Strategist Explains
798,Vitalik Buterin: Blockchain for Good | BlockShow x SFF
799,Will you make another turn with us?
800,"Bobby Lee: ""I am a Bitcoin Maximalist"""
801,STELLAR LUMENS | Simply Explained ft. Emma Stone
802,Stacks 2.0 Launch Event Stream | STX
803,"Blockchain Jobs, Bitcoin Adoption in Switzerland and North Korea | Hodler’s Digest"
804,What will trigger crypto’s next 10x growth? | Interview with Harmony COO
805,100 Years in Jail?! SBF Trial Verdict Explained
806,The Truth About Bitcoin in 2024: Are Your Investments Safe?
807,"Bakkt to the Near Future, DJ Khaled Gets Away with Another One | Hodler's Digest"
808,"51% Attack, Free Speech Under Attack? | Hodler's Digest"
809,Charlie Shrem's Way to Bitcoin | From Millionaire to Felon & Beyond
810,O3 Swap AMA: The cross-chain protocol that sources liquidity from multiple networks
811,"Blockchain Bandit Detected, Disney & Crypto, Samsung Develops Native Coin? | Hodler's Digest"
812,"CCN Back in Business, Catholic Crypto, Bitcoin’s Carbon Footprint | Hodler's Digest"
813,NEO's Smart Economy | Why do you HODL?
814,"Bitcoin SV News, Forbes Blockchain List, Notre Dame Des Cryptos | Game of Hodls"
815,‘Bitcoin is not designed to be leveraged’ | Exclusive interview with Caitlin Long
816,How Can You Prepare for Bitcoin ETF Approval?
817,Solana: Expectation Versus Reality
818,"BTC aims at $50K; Is ETH 'sound money'? ADA, ZEN, AVAX | The Market Report w/ Charlie Burton"
819,Why Tether Said NO to MiCA | Exclusive Interview with Paolo Ardoino
820,"Bitcoin Is Down, but Markets Get Stronger | Crypto Markets"
821,"Join Tim Draper, Meltem Demirors, Balaji Srinivasan, Dan Morehead & Others Part 1 | Unitize"
822,5 Key Steps to Win in Bull Markets | with @EricKrownCrypto
823,"Mike Butcher: ""We are looking for the decentralized players of the future"""
824,How bad is the FTX collapse for Bitcoin? On-chain analyst explains
825,"Disney building a park in the Metaverse, PayPal explores stablecoins | The Crypto Minute"
826,Welcome to BlockShow powered by Cointelegraph!
827,Scott Melker: Bitcoin will hit $100K in a month if Amazon buys
828,SBF allegedly paid a $150 million bribe to Chinese government officials
829,What is Vechain? | Jerome Grilleres Explains
830,"Leaving TradFi in the dust, Crescent defines DeFi"
831,What Are the Best Countries for Crypto Investors?
832,"Avengers of Crypto, Tether (USDT) Only 75% Tethered, Elon Musk & Ethereum | Hodler's Digest"
833,Can Bitcoin become the world’s reserve currency? | Exclusive interview with Dan Held
834,How will the Shanghai upgrade impact ETH’s price?
835,BREAKING: Bitcoin breaks ATH!! Where will it top? | The Market Report w/ Sam Bourgi
836,"Largest Dusting Attack in Litecoin History, Ponzi Scheme Causes Bitcoin Crash? | Crypto News"
837,Will the past catch up with presidential candidate Brock Pierce? | Interview
838,NEO and GAS Explained (UNDER TWO MINUTES) Baby Driver Edition
839,Meta (Facebook) CPO Chris Cox and Insider's Nicholas Carlson on the metaverse | Web Summit 2021
840,Naeem Aslam:  “I am a bull. I am completely a bull”
841,Bitcoin Hard Forks EXPLAINED | Segwit 2x Again?
842,Bitcoin continues consolidation: Are we still in a bull market? | The Market Report w/ Ran Neuner
843,How to invest in crypto in 2023 | Interview with Jeff Dorman
844,How blockchain can transform multi-trillion dollar industries | Alex & Don Tapscott Explain
845,OpenSea CEO explains why gaming is the most exciting use case for NFTs | Interview
846,"Tom Lee: ""Bitcoin Price Can Retain Its Old Highs"""
847,"Justin Sun’s $4.5 Million Dinner, SEC vs. Kik, LocalBitcoins Stops Cash Trades | Hodler’s Digest"
848,"Tether, Untethered | Hodler's Digest"
849,"Ethereum Tied to Bitcoin? Libra’s Future at Risk, Crown’s Market Analysis | Crypto News"
850,“I don’t have cash.” — Dan Tapiero explains his portfolio for 2022 | Interview
851,"ICOs, Bitcoin's Growth and The Blockchain Community: An Interview Ivan on Tech"
852,Farming Revolution: Blockchain and Tech Solutions by Dimitra
853,"Bear market? “So what,” says greatest chess player of all time"
854,How de-dollarization will spark the rise of Bitcoin and gold
855,Blockshow Day 1! Report
856,Bitcoin congestion: Are ordinals breaking BTC?
857,"Terra, Celsius, 3AC: How dangerous is the crypto market contagion?"
858,Koii AMA: The blockchain project built for media
859,"Why a Trump Presidency Could Spark an ""Altcoin Explosion"""
860,Disrupting the Payments Industry | Inside PumaPay
861,How Bitcoin netted Peter McCormack's childhood dream to buy a soccer team
862,"Crypto unicorns debate on DeFi, scalability, and interoperability | CV VC livestream"
863,"Brexit, Bill Clinton & Blockchain | Hodler's Digest"
864,"Web3 searches hit ATH, Bitcoin gifting, SHIB & DOGE most popular coins of 2021? | The Crypto Minute"
865,"Russia's central bank calls for ban on crypto, Microsoft’s metaverse move | The Crypto Minute"
866,Silvergate collapse: What does it mean for crypto?
867,How the U.S. SEC is waging an undeclared war on crypto
868,"Inflation at 40-year high, Bored Ape NFT sold for $3K, gift BTC on Cash App | The Crypto Minute"
869,Bitcoin NFTs — What are ordinals and why are they booming?
870,"Bitcoin, Gram, China - Libra, Libra, Libra! | Crypto News"
871,"How Is Media Impacting Bitcoin, JPM Coin & Book on Ethereum | Ex-Bloomberg Journalist Explains"
872,APENFT Marketplace: A zero-fee NFT ecosystem for everyone | AMA with David Uhryniak
873,How Grayscale plans to launch the first Bitcoin spot ETF by July 2022
874,Superbid AMA: Beginning the crypto revolution with the biggest influencers in the world
875,"CeDeFi, MetaFi, TradFi, and other opportunities for crypto hodlers | AMA with YouHodler"
876,Seoul Office Launch Party
877,Shiba Inu (SHIB): Meme coin or crypto revolution? BTC ETF | The Market Report w/ Eric Balchunas
878,How ETH 2.0 could become the VISA of crypto
879,TOP 5 People in Blockchain
880,"Bitcoin’s Peak Hash Rate, Booking.com Predicts Global Adoption | Crypto News"
881,Artificial Intelligence Explained | Interviews with Experts
882,Why Prince Philip of Serbia is bullish on Bitcoin (not crypto)
883,$3 billion stolen in hacks — Why are crypto crimes surging?
884,Cointelegraph Platform: CV-Labs “Bitcoin Halving View From The Crypto Valley”
885,"ETH and DOT make all-time highs, Burger King giving out DOGE, McRib NFTs | The Crypto Minute"
886,Top coins to buy in a bear market | The Market Report
887,Why token emissions are key for investing in DeFi projects | Interview with Shane Molidor
888,How the metaverse will reorganize humanity into global tribes | Interview with Yoni Assia
889,HATHOR AMA: Solving green Bitcoin mining with the merge mining Hathor.Green initiative
890,Should you hold Bitcoin or Ether in the long term? | Interview with Mati Greenspan
891,"El Salvador buys the dip, former Google CEO advising Chainlink, BitMart hacked | The Crypto Minute"
892,This Isn't Fun But It Makes Me $2k A Hour
893,5 Crypto Coins That Will 15x In DEC (Last Chance)
894,Why I'll NEVER Play Video Games Again After Learning This
895,"RICH KID BUYS 1,000 OVERWATCH LOOT BOXES : SUMMER GAME LOOT"
896,Want To Be Rich? Give Up These 4 Things…
897,How To Make 100x With TINY Crypto Coins (Full Guide To Micro Cap Trading)
898,"I Made $832,000 Flipping NFTs (Full Advanced Guide)"
899,7 Crypto Coins That Will 15x Early 2022 (Last Chance)
900,This Made Me Quit Alcohol Forever (You Will Too)
901,How Dopamine Detox Saved My Life
902,NO-FAP NIGHTMARE MODE RESULTS (AGING BACKWARDS)
903,4 Crypto Coins That Will 25x In Jan (FINAL Chance)
904,Crypto Gaming Will Make You A Millionaire. Use This Guide.
905,5 Crypto Coins That Will 15x In 30 Days (Urgent)
906,Why I'll NEVER Drink Caffeine Again After Learning This
907,6 Crypto Coins Set To 30x Nov 20th (2 Week Warning)
908,7 Crypto Coins LIKELY To 11x By NYE (Last Chance)
909,These 11 TINY Crypto ALT Coins Will 50x In DEC (URGENT AF)
910,Why (As A Millionaire) I Own NOTHING
911,These Crypto Coins Are True 100xs In 2022 (Yes Really)
912,DUMP ALL CRYPTO Before Bitcoin Does This (HUGE Crash : 2025 Bull Guide)
913,DUMP IT! Sell ALL Crypto & Bitcoin Before This Crash (HUGE Warning Signs Selling 101)
914,These 7 Crypto Coins Will 20x In 14 Days (Urgent)
915,8 NEW Crypto Coins 20xing Nov 24th (LAST BUY CHANCE)
916,These 15 TINY Crypto AI Coins Will 30x BY XMAS (URGENT AF)
917,TOP 9 AI Crypto Coins That Can 100x By May (Pump SOON List)
918,This Crypto Crash Will RUIN Lives (Actually Urgent)
919,I Sold ALL My Crypto & Stocks. Get Out NOW.
920,My Biggest Crypto Buy EVER (Expecting 110 Million Back)
921,3 20's Mistakes That Will Make You Poor In Your 30's
922,5 Crypto Coins That Will 15x In March (URGENT ACTUALLY)
923,DUMP IT! EXIT ALL BITCOIN and CRYPTO Before This Crash (Pre 2025 Crash Selling Guide)
924,This Will Kill BITCOIN In 2022. (Dec 22nd)
925,The WARNING Signs Of “Dopamine Toxication”
926,DEATH TRAP : Crypto Set To NUKE. DO THIS NOW (2025 Pre Bull Guide)
927,Idiots Buy Homes. Do This Instead.
928,"These 7 Cryptos Will 50x, I'm Investing Millions (Urgent)"
929,"Why Biz ""Gurus"" Keep You Poor & Stuck"
930,These 7 Crypto Coins Will 15x In DEC (Last Chance)
931,4 Crypto Trades That Will 10x By Jan (Last Chance)
932,13 Crypto Coins That Will 15x Early 2025 (URGENT AF)
933,I'm Buying Millions Of Crypto. You Should Too.
934,5 Crypto Coins That Will 15x In May (Last Chance)
935,6k In. 20 MIL out. The Best Investment Of My LIFE
936,EXTREME Minimalist House Tour
937,How To Make 100x With TINY Crypto Coins (2024 Guide For Micro Cap Trading)
938,3 Unfair Tricks The Super Rich Abuse
939,4 Skills That Can Make Nearly ANYONE Money Fast
940,SELL BTC: These 7 Crypto Coins Will 23x By 2025 (Still Early)
941,Why I Live Like A Monk
942,How I Used Addictions To Make Millions
943,How I Mastered Coding Games In 23 Days As A TOTAL BEGINNER
944,I'm So Sick Of Crypto Currency
945,"This 3am Daily Routine Unlocked My ""God Mode"" Focus"
946,How To Make 100x Flipping Metaverse Crypto Coins (Full Guide Metaverse Investing)
947,How Games Can 100x You and Break Reality
948,"They Are Paying Me $110,000,000 For This.."
949,CRASH! These ETH Crypto Coins Will 15x In Feb (URGENT AF)
950,Trump Did It! DUMP ALL Bitcoin & Crypto Before THIS
951,The Dark Tactic I Use To Stay Super Motivated
952,The 32 Crypto Coin Portfolio That Is Making Billions In 2024
953,These 3 Crypto Coins Will 30x By June (Yes Really)
954,7 Crypto Coins That Will 20x Early 2024 (Last Chance)
955,DISGUSTINGLY Easy Ways To Get Rich With AI By 2024
956,RESULTS : 30 Days NO CAFFEINE Changed My Life
957,🔴These 8 TINY Crypto ALT Coins Will 50x In May (URGENT AF)
958,"It's Gross, But It'll Make Even Beginners Millionaires By 2024"
959,Stocks and Crypto. STAY OUT NOW! (Actually Urgent)
960,TOP 11 AI Crypto Coins That Can 25x By Nov (Yes Really)
961,WAR IS HERE! SELL ALL BITCOIN AND CRYPTO NOW!
962,These 7 Crypto Coins Will 13x By MARCH (Last Chance)
963,LEAK! Whales Dumping BITCOIN (Actually Urgent)
964,My 100x Gaming Crypto Portfolio Broken Down
965,7 NEW Crypto Coins That'll 100x By May (Pump SOON List)
966,TRUMP JUST SENT CRYPTO NUCLEAR! Buy These 8 Coins NOW (URGENT AF)
967,I Spent Millions On Garbage
968,7 TINY Crypto Coins That Will 15x Mid 2024 (Last Chance Before TRUE Bull Run)
969,How To Make 100x With TINY Crypto Coins In 2025 (Full Guide To Micro Cap Trading)
970,These 5 Alt Coins Will 20x In 15 Days (HUGE Events)
971,I'm In 30 Mil. This Is Cryptos LAST Easy 100x.
972,My GIANT Crypto Investment ($42 Million Back)
973,CRASH : I'm Buying Millions In Crypto. You Should Too.
974,2 Mil A Month...BUT I Own NOTHING
975,3 100x AI Crypto Coins That Will PUMP By May
976,Spot These 10x Alt Coins NOW (Actually Urgent Alt Guide)
977,"Andrew Tate's ""Matrix"" Is Garbage"
978,The Best Thing To Invest In (Turned 6k Into 20 Mil)
979,These 5 NEW NFTs Will 50x Next Week (HUGE DROP LIST)
980,Books Are Slow & Stupid. Do This Instead.
981,5 Hacks That Gave Me Genius IQ
982,Trumps New China Rule Just NUKED Crypto (DO THIS NOW)
983,Trumps New CRYPTO FRAUD Has Gone To FAR!
984,Cardano Ecosystems Will 10x Soon (Actually Urgent)
985,This Holy Trifecta Gives Anyone IRON Willpower
986,SOLD ALL MY ETH For THE Best Coin Of April
987,🔴These 13 TINY AI Crypto Coins Will 85x In May (URGENT. LITERALLY)
988,How To Easily Find 100x Alt Coins (Beginner)
989,The Biggest Bitcoin Crash EVER (It's Not Done)
990,GRAHAM STEPHAN RUINED EVERYTHING
991,The Death Of Alex Becker
992,GRAHAM STEPHAN RUINED EVERYTHING
993,The Death Of Alex Becker
994,2020's 3 Biggest Opportunities
995,I'm Buying Tens Of Millions In Crypto. You Should Too
996,7 Alt Coins That Will Make Millionaires in 2 Weeks (Whale Dump and Pump)
997,60 DAYS NIGHTMARE NO FAP IS LIFE CHANGING
998,"Why ""Social"" Is Causing You Sub Conscious Brain Damage"
999,These 5 Gaming Cryptos Will PROBABLY 20x
1000,TOP 9 Gaming Cryptos That Can 100x By 2025 (Pump SOON List)
1001,Why Cardano WILL 10x And KILL ETH
1002,These 7 Crypto Coins Will 15x BEFORE Election (Last Chance)
1003,This Scared Me Into Quitting Coffee FOR LIFE
1004,Wanna Be Rich? Use This 10 Year Path (Beginner Friendly)
1005,These 8 Crypto Coins Will 15x By 2026 (Proof)
1006,My 3 Self Made Income Sources That Make Me 5 Million A Year
1007,HUGE RECESSION : Buy These 4 Assets NOW Before This
1008,How I Spot 10x Alt Coins FIRST (Easy And Repeatable)
1009,"How I Make $1,000,000+ A Year With Relative Ease"
1010,KEY Thoughts Only The .001% Has
1011,Q4 Bull JUST Started. These 7 Crypto Coins Will 25x By 2025
1012,BITCOIN IS DONE. I Sold EVERYTHING. (Here's Why)
1013,SELL Cardano LITERALLY Right NOW (Actually Urgent)
1014,Crypto Youtuber Tier List
1015,The 2020 Online Business Collapse Is Already Happening
1016,Why Bitcoin Will F#$K Everyone In 242 Days (SELL THIS NOW)
1017,DUMP Bitcoin For IMX Literally Right Now (Actually Urgent)
1018,I Sold. More Bitcoin Bear Dumps  Likely.
1019,Why I QUIT Youtube and Instagram
1020,SKIP BITCOIN! I Make $300k A Week With These Alt Coins
1021,These NEW Alt Coins Will 100x In 24 Hours (Epic Early Buy IDO Guide)
1022,Tesla NUKES Bitcoin For Cardano? (Happening NOW)
1023,These Crypto Game SCAMS Will RUIN Lives (Sell NOW)
1024,Apology To Cardano Holders (I Messed Up)
1025,These TINY Alt Coins Are About To 50x (Actually Urgent...)
1026,This Weekend Looks BAD For Bitcoin  (Actually Urgent)
1027,I'm Sick Of Youtube. I Quit.
1028,Suffering.
1029,Why Making Money Online Is Bull%^@!.
1030,GARY VEE'S NFT HYPE COULD RUIN LIVES
1031,I Sold.... BITCOIN Bull Run MAY Be Over....
1032,DUMP BITCOIN Into This EXACT Portfolio (252% Last Week)
1033,PolkaDots Ecosystem Will 10x (Actually Urgent)
1034,"SOLD ALL MY ETH For Cardano (Death Blow, GET OUT!)"
1035,Why Happy People Have Terrible Lives
1036,Bitcoin Mega Dump To 25k Incoming? (Heres The Odds)
1037,Why Money Keeps You Poor
1038,No Fap Nightmare Mode Broke Me. Fix This First!
1039,"How I Get ""Dark Web"" 100x ROI Alt Coins"
1040,"The ""Hidden"" Highest Income Businesses Of 2020"
1041,Want To Be Rich? STOP This Dirty Thought
1042,Entrepreneurship Is A LIE
1043,Why Rich People Have The Worst Depression
1044,The #1 Business To Start When You're Young In 2020
1045,How I Get Past Fear
1046,Whales To DUMP Bitcoin In 6 Days (Actually Urgent)
1047,I Wish I Stopped This Sooner
1048,7 DAY NO-FAP NIGHTMARE MODE RESULTS (LIFE CHANGING)
1049,How I Tricked My Brain To Not Fear Failure
1050,Biden Is About To KILL Bitcoin? (Actually Urgent)
1051,These 5 Alt Coins Will 10x SOON (Big Sept Buys)
1052,Buying Bitcoin NOW? Here's Why Your Doomed....
1053,Bitcoin Mega Sell Off Likely (Dead Cat Pattern)
1054,You Should Buy Bitcoin BEFORE October (3 BIG Reasons)
1055,"SKIP BITCOIN! Buy ONLY These Coins (1,400% Return)"
1056,THESE ALTCOINS ARE GIVING 1000X GAINS!! (Actually Urgent)
1057,SELLING ALL My Bitcoin For This April Gem
1058,This Rewired My Brain To Be Successful (Game Changer)
1059,Yep
1060,Why I'm Dumping Ethereum For This Coin
1061,His 5 Keys To Get Rich Young
1062,"$10,000 A Day Flipping Micro Alt Coins (Easy & Quick)"
1063,DUMP Ethereum Before This Big ALT Pump
1064,This Diet Increased My IQ 10 Points
1065,Ethereum Is A TERRIBLE Investment...Here's Why
1066,The 3 Stages Of Wealth EVERYONE Must Go Through
1067,SELL Bitcoin! 2nd Whale Dump Starting NOW (Actually Urgent)
1068,THIS IS TERRIFYING...STOP BUYING DOGE COIN NOW!
1069,Why I Hate Jeff Bezos
1070,No Purpose? This Question Saved My Life
1071,This Made Me Get Rid Of My Lamborghini Aventador
1072,Businesses That Are Doomed In 2020
1073,I Tried Extreme Minimalism For 30 Days : Here's What Happened
1074,(Advanced) The Ultimate Youtube Ads Guide (Youtube Prime Guide Part 1)
1075,5 Things I Wish I Knew Before Making Millions
1076,ETH About To DUMP For This HUGE Alt Pump (Get In NOW)
1077,MASSIVE DUMP Of Alt Coins & ETH HAPPENING NOW!
1078,SKIP BITCOIN! I Made $10k Flipping NFT Kitties (Beginner NFT Buying Guide)
1079,You Are NOT Sam Ovens. You Are NOT Russel Brunson.
1080,These 30x Coins Will SMASH Bitcoin
1081,The Great Lie Of Make Money Online
1082,"HOW TO SPOT BAD ""BIZ"" GURUS"
1083,URGENT : Avoid These NFTs At ALL COST!
1084,Why Instagram Ruins Young Entrepreneurs
1085,NEVER USE Social Media WITHOUT These 4 Blocking Apps (Brain Damage)
1086,3 50x AI Coins That Will PUMP Soon (Mega High Risk)
1087,"This Isn't Healthy, But It Makes Me 10x Smarter"
1088,The Largest Bitcoin Crash EVER (It's Not Over)
1089,How I Use Fear and Pain To Make Millions
1090,"SEVERE! WoW Addiction Made My Brain ""Grey"""
1091,"Bitcoin Will Crash More, Buy Back HERE"
